Title,Category,Link,Interest_Rating
Microsoft to delay release of Recall AI feature on security concerns,programming,https://www.reuters.com/technology/artificial-intelligence/microsoft-delay-release-recall-ai-feature-security-concerns-2024-06-14/,5.0
Scan HTML faster with SIMD instructions – Chrome edition,science,https://lemire.me/blog/2024/06/08/scan-html-faster-with-simd-instructions-chrome-edition/,6.0
"Show HN: Shpool, a Lightweight Tmux Alternative",other,https://github.com/shell-pool/shpool,5.0
"ASML Aims for Hyper-NA EUV, Shrinking Chip Limits ",science,https://www.eetimes.com/asml-aims-for-hyper-na-euv-shrinking-chip-limits,4.0
Brew-Nix: a flake automatically packaging all homebrew casks,science,https://discourse.nixos.org/t/brew-nix-a-flake-automatically-packaging-all-homebrew-casks/44880,5.0
Progressive Web Apps (PWAs) Phishing,science,https://mrd0x.com/progressive-web-apps-pwa-phishing,5.0
Show HN: Paramount – Human Evals of AI Customer Support,software,https://github.com/ask-fini/paramount,4.0
Designing a website without 404s,politics,https://pillser.com/engineering/2024-06-10-website-without-404s,5.0
Luma AI Dream Machine,programming,https://lumalabs.ai/dream-machine,5.0
Solving Probabilistic Tic-Tac-Toe,science,https://louisabraham.github.io/articles/probabilistic-tic-tac-toe,5.0
Lamini Memory Tuning: 10x Fewer Hallucinations,ai,https://www.lamini.ai/blog/lamini-memory-tuning,6.0
AMD CEO Lisa Su reminisces about designing the PS3's infamous Cell processor,programming,https://www.tomshardware.com/tech-industry/amd-ceo-lisa-su-reminisces-on-helping-design-the-ps3s-infamous-cell-processor-at-ibm,6.0
React 19 Breaks Async Composability,politics,https://github.com/facebook/react/pull/26380,5.0
Encodings for flattened heap values,programming,https://cr.openjdk.org/~jrose/values/flattened-values.html,5.0
Lambda Calculus Interpreter,science,https://lambda-calculus-interpreter.netlify.app/?term=(%CE%BBt.%20t%20t%20(%CE%BBh%20f%20n.%20n%20h%20f%20n)%20t%20t%20t)%20(%CE%BBf%20x.%20f%20(f%20x)),7.0
Indian startup 3D prints rocket engine in 72 hours,ai,https://spectrum.ieee.org/3d-printed-rocket,3.0
I Found a 55 Year Old Bug in the First Lunar Lander Game,politics,https://martincmartin.com/2024/06/14/how-i-found-a-55-year-old-bug-in-the-first-lunar-lander-game/,3.0
Microsoft's Recall AI feature is now indefinitely delayed,websites,https://blogs.windows.com/windowsexperience/2024/06/07/update-on-the-recall-preview-feature-for-copilot-pcs/,6.0
Nvidia Warp: A Python framework for high performance GPU simulation and graphics,science,https://github.com/NVIDIA/warp,7.0
Cost of self hosting Llama-3 8B-Instruct,other,https://blog.lytix.co/posts/self-hosting-llama-3,4.0
Effect – Build robust apps in TypeScript,programming,https://effect.website/,4.0
Start presentations on the second slide,programming,https://tidyfirst.substack.com/p/start-presentations-on-the-second,5.0
Map of forest sounds from around the world,websites,https://timberfestival.org.uk/soundsoftheforest-soundmap/,5.0
YouTube embeds ads into videos to beat ad blockers,science,https://searchengineland.com/youtube-embeds-ads-videos-ad-blockers-443187,5.0
Sleep deprivation disrupts memory,other,https://www.nature.com/articles/d41586-024-01732-y,5.0
Dark Software,ai,https://notes.mtb.xyz/p/dark-software,5.0
The problem with OpenTelemetry,science,https://cra.mr/the-problem-with-otel/,4.0
Turning the Tables on AI,software,https://ia.net/topics/turning-the-tables-on-ai,5.0
Hydra: Generalizing Peephole Optimizations with Program Synthesis [pdf],other,https://users.cs.utah.edu/~regehr/generalization-oopsla24.pdf,8.0
Vercel ends open-source sponsorship program giving projects 24hr notice,security,https://vercel.com/guides/can-vercel-sponsor-my-open-source-project,7.0
Effect of passenger position on crash injury risk in aircraft (2015) [pdf],science,https://www.tc.faa.gov/its/worldpac/techrpt/am15-17.pdf,5.0
ESASky,hardware,https://sky.esa.int/esasky/,4.0
Perplexity AI Is Lying about Their User Agent,software,https://rknight.me/blog/perplexity-ai-is-lying-about-its-user-agent/,8.0
Engineer's Solar Panels Are Breaking Efficiency Records,science,https://spectrum.ieee.org/solar-panels-breaking-efficiency-records,5.0
Show HN: Keydogger – Minimal keyboard macro for Linux(Wayland),programming,https://github.com/jarusll/keydogger,5.0
Leveraging Zig's Allocators,science,https://www.openmymind.net/Leveraging-Zigs-Allocators/,6.0
A most profound video game: a good cognitive aid for research,programming,https://thoughtforms.life/a-most-profound-video-game-a-good-cognitive-aid-for-research-at-the-frontier-of-life-and-mind/,3.0
Acorn Computer Systems catalogue circa 1983,other,https://blog.jgc.org/2024/06/acorn-computer-systems-catalogue-circa.html,8.0
Threescaper: A website for loading Townscaper models into Three.js,privacy,https://github.com/meliharvey/threescaper,6.0
Embedded Swift [video],science,https://www.youtube.com/watch?v=LqxbsADqDI4,7.0
DARPA Shows Concepts for the Future of VTOL Uncrewed Aerial Systems,other,https://www.darpa.mil/news-events/2024-05-22,5.0
Address Sanitizer Internals,programming,https://blog.gistre.epita.fr/posts/benjamin.peter-2022-10-28-address_sanitizer_internals/,6.0
Some early results for feed reader behavior monitoring,software,http://rachelbythebay.com/w/2024/06/11/fsr/,7.0
Can Language Models Serve as Text-Based World Simulators?,politics,https://arxiv.org/abs/2406.06485,3.0
Perfectionism is optimizing at the wrong scale,ai,https://www.autodidacts.io/holistic-perfectionism/,6.0
Voyager 1 is back online! NASA spacecraft returns data from all 4 instruments,other,https://www.space.com/voyager-1-fully-operational,8.0
Nango (YC W23) Is Hiring a Senior Product Engineer (100% Remote),science,https://www.nango.dev/jobs,5.0
The Four Kinds of Research-and-Development Teams,politics,http://blogs.newardassociates.com/blog/2024/four-kinds-of-rd-teams.html,6.0
Southwest flight came within 400 feet of crashing into the ocean,programming,https://www.cnn.com/2024/06/15/us/southwest-flight-hawaii-federal-investigation/index.html,5.0
Is This the First Nintendo Commercial?,hardware,https://gamehistory.org/mego-time-out-commercial/,5.0
Survey of Rickrolling in Academic Literature [pdf],science,https://arxiv.org/abs/2204.06826,5.0
Diagnosing video signal loss on Wii and GBS-Control,other,https://nyanpasu64.gitlab.io/blog/wii-gbs-c-sync-loss/,4.0
Introduction to the Odin Programming Language,science,https://zylinski.se/posts/introduction-to-odin/,8.0
Exponentially Better Rotations (2022),ai,http://thenumb.at/Exponential-Rotations/,4.0
"Syzygy: An open standard for low cost, compact and high-performance peripherals",other,https://syzygyfpga.io/,5.0
Radioactive drugs strike cancer with precision,software,https://knowablemagazine.org/content/article/health-disease/2024/cancer-fighting-radiopharmaceuticals-are-taking-off,7.0
Eden Abhez: The strangest hit songwriter,programming,https://www.honest-broker.com/p/the-strangest-hit-songwriter-in-history,6.0
Apple announced RCS with a whimper when it should have been a bang,other,https://www.theverge.com/2024/6/15/24178470/apple-rcs-support-wwdc-announcement-android-imessage,5.0
"How to Raise a Tribal Army in Pre-Roman Europe, Part II",hardware,https://acoup.blog/2024/06/14/collections-how-to-raise-a-tribal-army-in-pre-roman-europe-part-ii-government-without-states/,7.0
Chaos in the medium: Watercolour plotting,security,https://www.amygoodchild.com/blog/watercolour-plots,6.0
Useful and Overlooked Skills,operating systems,https://collabfund.com/blog/useful-and-overlooked-skills/,5.0
"Two announcements: AI for Math resources, and erdosproblems.com",other,https://terrytao.wordpress.com/2024/04/19/two-announcements-ai-for-math-resources-and-erdosproblems-com/,5.0
Face of ancient Australian 'giga-goose' revealed after fossil skull found,websites,https://www.nhm.ac.uk/discover/news/2024/june/face-ancient-australian-giga-goose-revealed-after-fossil-skull-found.html,4.0
Ventoy: Remove BLOBs from the Source Tree,hardware,https://github.com/ventoy/Ventoy/issues/2795,6.0
What About libjpeg v9? (2013),science,https://libjpeg-turbo.org/About/Jpeg-9,8.0
Tesla in self-drive mode slams into police car in Orange County,software,https://ktla.com/news/local-news/tesla-in-self-drive-mode-slams-into-police-car-in-orange-county/,5.0
America Is Losing the Shoe Race with China,programming,https://www.csis.org/blogs/working-papers/america-losing-shoe-race-china,5.0
From grep to SPLADE: a journey through semantic search,science,https://blog.elicit.com/semantic-search/,6.0
The Day I Learned to Think Like a Browser,operating systems,https://www.thebookwormsburrow.com/p/the-day-i-learned-to-think-like-a,5.0
AI Search: The Bitter-Er Lesson,programming,https://yellow-apartment-148.notion.site/AI-Search-The-Bitter-er-Lesson-44c11acd27294f4495c3de778cd09c8d,5.0
The borrow checker within,other,https://smallcultfollowing.com/babysteps/blog/2024/06/02/the-borrow-checker-within/,7.0
Using a 1965 Dutch Rotary Phone via VoIP (T65) in 2024,science,https://raymii.org/s/blog/Using_a_1965_Dutch_Rotaty_Phone_T65_via_VoIP_in_2024.html,5.0
Nondeterminism in Formal Specification,ai,https://buttondown.email/hillelwayne/archive/nondeterminism-in-formal-specification/,5.0
Kizhi Pogost,other,https://whc.unesco.org/en/list/544/,8.0
Overcoming pitfalls of Postgres logical decoding,programming,https://blog.peerdb.io/overcoming-pitfalls-of-postgres-logical-decoding,5.0
I found a 55 year old bug in the first Lunar Lander game,science,https://martincmartin.com/2024/06/14/how-i-found-a-55-year-old-bug-in-the-first-lunar-lander-game/,5.0
Show HN: Elles – A nicer /bin/ls,science,https://github.com/arp242/elles,5.0
How to design and manufacture your own chip [video],politics,https://www.youtube.com/watch?v=caXwuuXSB-A,4.0
Jean Stein's Rolodex: The legendary editor's social genius,science,https://yalereview.org/article/benjamin-anastas-jean-steins-rolodex,4.0
"Inkdown is an open source Markdown reading, editing, and sharing tool",ai,https://github.com/1943time/bluestone,7.0
Tracing Intel's Atom Journey: Goldmont Plus,science,https://chipsandcheese.com/2024/06/10/tracing-intels-atom-journey-goldmont-plus/,4.0
Mewz: Unikernel written in Zig for running WASI-compatible WASM applications,websites,https://github.com/mewz-project/mewz,4.0
"What, Me Worry? Or Should We Fear Intelligent Machines? – Gerald Jay Sussman [video]",programming,https://www.youtube.com/watch?v=skvP2tlVPVA,5.0
Spaced repetition for teaching two-year olds how to read,programming,https://chrislakin.blog/p/spaced-repetition-for-teaching-two,5.0
The sun's magnetic field is about to flip,operating systems,https://www.space.com/sun-magnetic-field-flip-solar-maximum-2024,7.0
"""The Door Problem"" (2014)",software,https://lizengland.com/blog/2014/04/the-door-problem/,9.0
H.264 Is Magic (2016),programming,https://sidbala.com/h-264-is-magic/,8.0
Herbert A. Simon and Jorge Luis Borges About Free Will (2023),politics,https://www.cambridge.org/core/journals/journal-of-the-history-of-economic-thought/article/abs/on-herbert-a-simon-and-jorge-luis-borges-about-free-will/27D7CC976FF4C903881C7F5C91C53664,5.0
Anticipatory Anxiety,politics,https://www.lrb.co.uk/the-paper/v46/n12/william-davies/anticipatory-anxiety,5.0
Making my local LLM voice assistant faster and more scalable with RAG,operating systems,https://johnthenerd.com/blog/faster-local-llm-assistant/,2.0
New algorithm discovers language just by watching videos,science,https://www.csail.mit.edu/news/new-algorithm-discovers-language-just-watching-videos,5.0
Sonos changes terms and conditions and may now pass on data to third parties,politics,https://www.notebookcheck.net/Sonos-changes-terms-and-conditions-and-may-now-pass-on-data-to-third-parties.848124.0.html,5.0
Edmond Albius's method of pollination is now used by all vanilla growers,other,https://nautil.us/the-boy-who-was-king-of-vanilla-522772/,4.0
True Defamation [pdf],science,https://www.journaloffreespeechlaw.org/helmreich.pdf,3.0
"The 3-way fight for a 1,800km long mountain ridge under the Arctic",hardware,https://everythingisamazing.substack.com/p/theres-something-incredible-under,6.0
The Microsoft Excel superstars throw down in Vegas,science,https://www.theverge.com/c/24133822/microsoft-excel-spreadsheet-competition-championship,5.0
Study finds juvenile dolphins who play together are more successful as adults,science,https://phys.org/news/2024-06-juvenile-dolphins-play-successful-adults.html,5.0
The first 'major lunar standstill' in more than 18 years is about to occur,ai,https://www.livescience.com/space/the-moon/the-1st-major-lunar-standstill-in-more-than-18-years-is-about-to-occur-heres-how-to-see-it,4.0
FAA investigating how counterfeit titanium got into Boeing and Airbus jets,ai,https://www.nytimes.com/2024/06/14/us/politics/boeing-airbus-titanium-faa.html,2.0
I bought an encyclopedia,programming,https://www.optoutproject.net/what-is-true-on-the-internet/,5.0
Satellite data show electromagnetic anomalies 19 days before Turkey earthquake,ai,https://phys.org/news/2024-06-satellite-reveal-electromagnetic-anomalies-days.html,4.0
Japanese addresses: No street names. Block numbers (2009),politics,https://sive.rs/jadr,5.0
"Fear and hardship for the last community inside Chitwan, Nepal's tiger central",science,https://news.mongabay.com/2024/06/fear-and-hardship-for-the-last-community-inside-chitwan-nepals-tiger-central/,3.0
Hopac: Concurrent ML Implementation in F#,science,https://github.com/Hopac/Hopac/blob/master/Docs/Programming.md,9.0
Stanford Internet Observatory wilts under legal pressure during election year,science,https://www.theregister.com/2024/06/14/stanford_internet_observatory/,5.0
Hydra: Generalizing peephole optimizations with program synthesis [pdf],politics,https://users.cs.utah.edu/~regehr/generalization-oopsla24.pdf,4.0
Pico SDR,ai,https://blog.porucha.net/2024/pico-sdr/index.html,5.0
Scientists develop fatigue-free ferroelectric material,science,https://phys.org/news/2024-06-scientists-fatigue-free-ferroelectric-material.html,8.0
Germany after the European elections,science,https://adamtooze.substack.com/p/chartbook-293-nope-or-the-political,6.0
"'Cheapfake' Biden videos enrapture right-wing media, but deeply mislead",politics,https://www.washingtonpost.com/politics/2024/06/14/cheapfake-biden-videos-enrapture-right-wing-media-deeply-mislead/,5.0
Britain's 'Pompeii': UK's Largest Bronze Age Find,science,https://www.bbc.com/news/articles/cx8q32rj2yjo,5.0
"Lies, Damn Lies, and Data Science",other,https://beabytes.com/data-science-lies/,7.0
The challenge of writing a on-demand transcoder,programming,https://zoriya.dev/blogs/transcoder/,5.0
Driving forward in Android drivers,websites,https://googleprojectzero.blogspot.com/2024/06/driving-forward-in-android-drivers.html,5.0
James Webb Space Telescope spots asteroid collision in neighboring star system,programming,https://www.space.com/james-webb-space-telescope-asteroid-collision-beta-pictoris,5.0
Freenet 2024 – a drop-in decentralized replacement for the web [video],programming,https://www.youtube.com/watch?v=enTAromEeHo,3.0
Alan Bates the campaigner for the Post Office IT scandal has been knighted,ai,https://www.theguardian.com/uk-news/article/2024/jun/14/post-office-campaigner-alan-bates-knighted-in-kings-birthday-honours,6.0
Show HN: SHAllenge – Compete to get the lowest hash,programming,https://shallenge.quirino.net/,5.0
The oldest ecosystems on Earth,programming,https://nautil.us/the-oldest-ecosystems-on-earth-650875/,5.0
The Impossibility of Supersized Machines (2017),politics,https://arxiv.org/abs/1703.10987,4.0
Milk-V Duo: A RISC-V SBC that runs Linux and RTOS/Arduino for $5,other,https://milkv.io/duo#,4.0
DARPA unveils 6 new designs for uncrewed vertical-takeoff military aircraft,operating systems,https://www.livescience.com/technology/engineering/darpa-considers-6-new-designs-for-uncrewed-vtol-aircraft-that-carry-weapons-payloads-with-test-flights-set-for-2026,5.0
Which Root Certificates should you trust? Find out with CertInfo,ai,https://raymii.org/s/software/Which_Root_Certificates_Should_You_Trust_CertInfo.html,5.0
Rest of World's 2024 global playlist,software,https://restofworld.org/music/,4.0
Django SQLite Production Config,science,https://blog.pecar.me/sqlite-django-config,5.0
"The ""uncanny"" is the experience of a loss of control",websites,https://ykulbashian.medium.com/the-uncanny-is-the-experience-of-a-loss-of-control-06a3fb4dbcd1,4.0
My thoughts on Python in Excel,politics,https://www.xlwings.org/blog/my-thoughts-on-python-in-excel,6.0
The Measure of Intelligence,software,https://arxiv.org/abs/1911.01547,4.0
Stanford files amicus brief in Murthy vs. Missouri,other,https://cyber.fsi.stanford.edu/io/news/update-amicus-sio-2024,8.0
Mouth-based touchpad enables people living with paralysis to use computers,science,https://news.mit.edu/2024/mouth-based-touchpad-augmental-0605,6.0
Show HN: Paramount – Human Evals of AI Customer Support,science,https://github.com/ask-fini/paramount,5.0
ASHA for Linux,science,https://github.com/thewierdnut/asha_pipewire_sink,5.0
Kaprekar's Magic 6174,science,https://www.oranlooney.com/post/kaprekar/,5.0
PlayStation Portal (Remote Play): Stack-buffer overflow in HEVC decoder,other,https://github.com/google/security-research/security/advisories/GHSA-c24v-5836-j27w,6.0
"Show HN: XDeck – An ad-blocking client app for macOS, like TweetDeck",science,https://github.com/morishin/XDeck,5.0
"Snowden: ""They've gone full mask-off: do not ever trust OpenAI or its products""",other,https://twitter.com/Snowden/status/1801610725229498403,5.0
POSIX.1-2024 is published,privacy,https://ieeexplore.ieee.org/document/10555529,7.0
The Swift compiler is slow due to how types are inferred,ai,https://danielchasehooper.com/posts/why-swift-is-slow/,1.0
ZeroPoint's nanosecond-scale memory compression could tame power-hungry AI infra,science,https://techcrunch.com/2024/05/23/zeropoints-nanosecond-scale-memory-compression-could-tame-power-hungry-ai-infrastructure/,5.0
Camping – Ruby Web Microframework,ai,https://github.com/camping/camping,8.0
Microsoft answered Congress' questions on security. The White House needs to act,ai,https://www.theregister.com/2024/06/15/microsoft_brad_smith_congress/,6.0
Banana giant Chiquita held liable by US court for funding paramilitaries,politics,https://www.bbc.com/news/articles/c6pprpd3x96o,5.0
Nemotron-4-340B,science,https://blogs.nvidia.com/blog/nemotron-4-synthetic-data-generation-llm-training/,5.0
"The rise and fall of Koo, India’s once-thriving Twitter alternative",science,https://restofworld.org/2024/twitter-alternative-koo/,5.0
Oracle is shutting down its ad business,other,https://www.adweek.com/programmatic/oracle-is-shutting-down-its-ad-business/,4.0
Uncensor any LLM with abliteration,programming,https://huggingface.co/blog/mlabonne/abliteration,5.0
"Bibliography keys: It's as easy as [1], [2], [3]",ai,http://blog.cr.yp.to/20240612-bibkeys.html,4.0
TorrentGalaxy Goes Offline with Mysterious Message to Users,science,https://torrentfreak.com/torrentgalaxy-goes-offline-with-mysterious-message-to-users-240614/,2.0
A new map of medieval London,ai,https://londonist.substack.com/p/a-new-map-of-medieval-london,4.0
Gerald Sussman: Programming is (should be) fun (2022) [video],hardware,https://www.youtube.com/watch?v=2MYzvQ1v8Ww,6.0
KDE Receives New Human Interface Guidelines for 2024,science,https://www.phoronix.com/news/KDE-New-HIG-2024,6.0
"GitBook, Effortless API Documentation",science,https://www.gitbook.com/,6.0
Former Neuralink Staffer Sues After Scratches from Herpes Monkey,software,https://www.bloomberg.com/news/articles/2024-06-15/former-neuralink-staffer-sues-after-scratches-from-herpes-monkey,5.0
Huawei reportedly selling beef it received as sanctions-evading payment,politics,https://wccftech.com/huawei-is-now-reportedly-selling-beef-products-that-it-received-as-sanctions-evading-payment-for-the-5g-equipment/,6.0
Converting In-Context Learning to Weights in Linearized-Attention Transformers,software,https://arxiv.org/abs/2406.02847,5.0
Drawing Machines,science,https://drawingmachines.org/,5.0
Mushroom hunters can't stop finding mysterious fungi,websites,https://www.nytimes.com/2024/06/11/science/mushroom-hunters-dna.html,6.0
The ‘Network of Web Trees’ in Gaza,science,https://globalvoices.org/2024/06/13/the-ingenious-network-tree-defying-gazas-connectivity-blockade/,5.0
100-foot 'walking tree' in New Zealand,science,https://www.livescience.com/planet-earth/plants/100-foot-walking-tree-in-new-zealand-looks-like-an-ent-from-lord-of-the-rings-and-is-the-lone-survivor-of-a-lost-forest,5.0
"The Cleantech Revolution It's exponential, disruptive, and now",science,https://rmi.org/insight/the-cleantech-revolution/,5.0
Land value tax in online games and virtual worlds (2022),science,https://progressandpoverty.substack.com/p/land-value-tax-in-online-games-and,5.0
Crypto Titans' $160M War Chest Threatens Senate Democrats,science,https://www.yahoo.com/news/crypto-titans-160-million-war-100000741.html,5.0
We spent a week in China. Here's what we learned about our global rival,science,https://text.npr.org/g-s1-4569,5.0
What If We Recaption Billions of Web Images with LLaMA-3?,politics,https://arxiv.org/abs/2406.08478,5.0
Wild elephants may have names that other elephants use to call them,science,https://www.npr.org/2024/06/07/nx-s1-4994426/wild-elephants-individual-names,9.0
Ask HN: Would you use an architecture diagram tool to save infra costs?,ai,item?id=40688245,3.0
How much did the Apollo program cost?,operating systems,https://www.planetary.org/space-policy/cost-of-apollo,7.0
"Twenty, a modern CRM alternative to Salesforce",science,https://twenty.com,5.0
Ottertune.ai Is Shut Down,other,https://ottertune.com/index.html,5.0
Browser extension that globally blocks vertical video?,ai,item?id=40684982,3.0
Apple and Meta could face charges for violating EU tech rules,programming,https://www.theverge.com/2024/6/14/24178724/apple-meta-eu-charges-dma,6.0
Z80 CPU User Manual [pdf],ai,http://www.zilog.com/docs/z80/um0080.pdf,4.0
Whose CIDR is it anyway?,science,https://www.netmeister.org/blog/cidr-allocations.html,5.0
Terence Tao on proof checkers and AI programs,politics,https://www.scientificamerican.com/article/ai-will-become-mathematicians-co-pilot/,8.0
Group chats rule the world,programming,https://sriramk.com/group-chats-rule-the-world,3.0
Progressive Web Apps (PWAs) Phishing,science,https://mrd0x.com/progressive-web-apps-pwa-phishing/,6.0
Borges on Chaos Theory,science,https://aethermug.com/posts/borges-on-chaos-theory,7.0
Centuries of Childhood,science,https://resobscura.substack.com/p/centuries-of-childhood,4.0
Philips Tableaux with 13-inch E Ink Display Launched at InfoComm 2024,other,https://goodereader.com/blog/e-paper/philips-tableaux-with-13-inch-e-ink-display-launched-at-infocomm-2024,5.0
Using AI to decode dog vocalization,websites,https://news.umich.edu/using-ai-to-decode-dog-vocalizations/,7.0
Turning the Tables on AI,politics,https://ia.net/topics/turning-the-tables-on-ai,7.0
Ask HN: Why is nobody manufacturing low tech electric cars in 2024?,politics,item?id=40668427,5.0
MLow: Meta's low bitrate audio codec,programming,https://engineering.fb.com/2024/06/13/web/mlow-metas-low-bitrate-audio-codec/,5.0
Three Views on the California Math Framework [pdf],science,https://www.ams.org/journals/notices/202406/rnoti-p797.pdf,5.0
"ASML Aims for Hyper-NA EUV, Shrinking Chip Limits",politics,https://www.eetimes.com/asml-aims-for-hyper-na-euv-shrinking-chip-limits/,5.0
Southwest Plane Plunged Within 400 Feet of Ocean Near Hawaii,hardware,https://www.msn.com/en-us/money/other/southwest-plane-plunged-within-400-feet-of-ocean-near-hawaii/ar-BB1ofg8n,9.0
"Microsoft Chose Profit over Security, Whistleblower Says",programming,https://www.propublica.org/article/microsoft-solarwinds-golden-saml-data-breach-russian-hackers,4.0
The 30-meter pass in the Pyrenees through which millions of insects migrate,science,https://english.elpais.com/climate/2024-06-13/the-30-meter-pass-in-the-pyrenees-through-which-millions-of-insects-migrate.html,5.0
Invention to Impact: The story of LASIK eye surgery,science,https://new.nsf.gov/science-matters/invention-impact-story-lasik-eye-surgery,5.0
Perspective-Correct Interpolation,websites,https://andrewkchan.dev/posts/perspective-interpolation.html,8.0
IntelliJ GitHub Plugin leaking credentials,politics,https://blog.jetbrains.com/security/2024/06/updates-for-security-issue-affecting-intellij-based-ides-2023-1-and-github-plugin/,5.0
HumanPlus: Humanoid Shadowing and Imitation from Humans,programming,https://humanoid-ai.github.io/,5.0
ChatGPT-like self-hosted platform,science,https://github.com/singulatron/singulatron,5.0
"What Emacs got right, or how modern apps were more like 50 year old text editor",science,https://danielde.dev/blog/what-emacs-got-right,5.0
Tesla's FSD – A Useless Technology Demo,hardware,https://tomverbeure.github.io/2024/05/20/Tesla-FSD-First-and-Last-Impressions.html,3.0
Lexbor – An open source HTML Renderer library,privacy,https://github.com/lexbor/lexbor,9.0
Swift Static Linux SDK,other,https://www.swift.org/documentation/articles/static-linux-getting-started.html,5.0
The development process of Wordbots (2016–2023),programming,https://alex.nisnevich.com/blog/2024/06/02/wordbots_retrospective.html,7.0
The GJK Algorithm: A weird and beautiful way to do a simple thing,politics,https://computerwebsite.net/writing/gjk,5.0
Meta will not launch Meta AI in Europe for now,websites,https://www.reuters.com/technology/artificial-intelligence/meta-will-not-launch-meta-ai-europe-now-2024-06-14/,4.0
"Apple punishes women for same behaviors that get men promoted, lawsuit says",other,https://arstechnica.com/tech-policy/2024/06/apple-deliberately-pays-women-less-than-men-lawsuit-says/,5.0
