Title,Category,Link,Interest_Rating
Walking to combat back pain,programming,https://lighthouse.mq.edu.au/article/june-2024/walking-away-from-pain-world-first-study-shows-dramatic-improvement-in-lower-back-trouble,6.0
More ARM Linux Laptops Are on the Way,websites,https://www.howtogeek.com/tuxedo-computers-arm-linux-laptop/,5.0
US Bans Kaspersky Software,programming,https://www.wired.com/story/us-bans-kaspersky-software/,4.0
Seven Conversation Hacks,science,https://randsinrepose.com/archives/seven-conversation-hacks/,3.0
A ship off Israel's coast could shed light on the navigation of ancient mariners,ai,https://phys.org/news/2024-06-ship-israel-coast-skills-ancient.html,6.0
The 10x developer makes their whole team better,politics,https://stackoverflow.blog/2024/06/19/the-real-10x-developer-makes-their-whole-team-better/,8.0
"Birth rates halve in richer countries as costs weigh, OECD report says",science,https://www.reuters.com/world/birth-rates-halve-richer-countries-costs-weigh-oecd-report-says-2024-06-20/,2.0
"More disabled Americans are employed, thanks to remote work",ai,https://www.bloomberg.com/news/articles/2024-06-20/remote-work-helps-more-people-with-disabilities-get-employed,5.0
OpenPipe Mixture of Agents: Outperform GPT-4 at 1/25th the Cost,ai,https://openpipe.ai/blog/mixture-of-agents,5.0
Ask HN: Bootsrappers who were Software Engineers. How was your journey?,science,item?id=40744034,4.0
"Groqnotes: Generate structured notes from audio using Groq, Whisper, and Llama3",science,https://github.com/Bklieger/groqnotes,5.0
"What is ZIRP, and how did it impact the startup world?",programming,https://www.ycombinator.com/blog/what-is-zirp-and-how-did-it-impact-the-startup-world/,6.0
Tao of Programming,science,https://www.talisman.org/tao/,6.0
Claude 3.5 Sonnet takes the top spot on Aider LLM Leaderboards,other,https://aider.chat/docs/leaderboards/#claude-35-sonnet-takes-the-top-spot,5.0
NYC Surveillance Tech on Shootings Gives False Alarms 87% of Time,science,https://www.bloomberg.com/news/articles/2024-06-20/nyc-shotspotter-tech-wastes-nypd-police-time-and-money-audit-finds,6.0
Tor Browser 13.5 is released,ai,https://blog.torproject.org/new-release-tor-browser-135/,5.0
1/3 of car buyers say absence of Apple or Android Auto would be a deal-breaker,politics,https://www.autonews.com/mobility-report/buyers-shun-cars-lacking-apple-carplay-android-auto-survey-says,6.0
Ask HN: How do you organize your expertise?,other,item?id=40744267,4.0
Silicon Valley Is Turning into Its Own Worst Fear (2017),science,https://www.buzzfeednews.com/article/tedchiang/the-real-danger-to-civilization-isnt-ai-its-runaway,6.0
"Tesla owners file class-action alleging repair, parts monopoly",science,https://driving.ca/auto-news/industry/tesla-class-action-lawsuite-parts-repairs-monopoly,5.0
Community Gardens and Food Security in Russia,science,https://www.notechmagazine.com/2020/03/a-dacha-for-everyone-community-gardens-and-food-security-in-russia.html,6.0
Video annotator: a framework for efficiently building video classifiers,science,https://netflixtechblog.com/video-annotator-building-video-classifiers-using-vision-language-models-and-active-learning-8ebdda0b2db4,6.0
"There are no particles, there are only fields (2012)",politics,https://arxiv.org/abs/1204.4616,8.0
Elon Musk is trying to woo advertisers after telling them to 'go fuck yourself',software,https://www.cnn.com/2024/06/20/media/elon-musk-advertisers-cannes-lions/index.html,6.0
Forbes threatens Perplexity with legal action,science,https://www.axios.com/2024/06/18/forbes-perplexity-ai-legal-action-copyright,3.0
Tiny Teensy Executables,science,https://www.muppetlabs.com/~breadbox/software/tiny/teensy.html,7.0
Insufficient Sun Exposure Has Become a Real Public Health Problem (2020),programming,https://www.ncbi.nlm.nih.gov/pmc/articles/PMC7400257/,6.0
"Citing national security, US will ban Kaspersky anti-virus software in July",science,https://arstechnica.com/tech-policy/2024/06/citing-national-security-us-will-ban-kaspersky-anti-virus-software-in-july/,6.0
Consciousness vs. the Ruliad – Stephen Wolfram Λ Donald Hoffman [video],privacy,https://www.youtube.com/watch?v=1m7bXNH8gEM,4.0
Ask HN: Is Docker difficult for non technical people?,politics,item?id=40739985,5.0
The first attempt to replace SORBS didn't take long,other,https://www.theregister.com/2024/06/17/infosec_news_in_brief/,6.0
New York Establishes Stringent Protections to Safeguard Kids on Social Media,science,https://www.governor.ny.gov/news/governor-hochul-joins-attorney-general-james-and-bill-sponsors-sign-nation-leading-legislation,4.0
"IBM, Kyndryl again sued for age discrimination – this time by its own VPs",science,https://www.theregister.com/2024/06/20/ibm_and_kyndryl_again_sued/,5.0
Plants have their own form of intelligence,science,https://studyfinds.org/plants-intelligence/,5.0
Docker Is Having an Outage,ai,https://downdetector.com/status/docker/,6.0
Major Labels Weighing Lawsuit Against Suno and Udio for Unlicensed Training,other,https://www.billboard.com/pro/major-labels-weighing-lawsuit-ai-suno-udio-alleged-unlicensed-training/,8.0
Wired Confirms Perplexity Is Bypassing Efforts by Websites to Block Its Crawler,other,https://www.macstories.net/stories/wired-confirms-perplexity-is-bypassing-efforts-by-websites-to-block-its-web-crawler/,4.0
US bans sales of Kaspersky antivirus software over Russia ties,privacy,https://www.theguardian.com/us-news/article/2024/jun/21/us-kaspersky-antivirus-software-ban-russia-ties,6.0
"Show HN: Simpler web dev with Htmx, SQLite and TypeScript",ai,https://www.plainweb.dev/,4.0
Understand AI Companies: Think Like a Psychopath,ai,https://inkican.com/understand-ai-companies-think-like-a-psychopath/,6.0
Comparing the Framework Laptop with the MacBook Air M2: A Detailed Review,politics,https://quail.ink/lyric_na/p/comparing-the-framework-laptop-with-the-macbook-air-m2-a-detailed-review,5.0
The Chinese EV Dilemma: Subsidized yet Striking,science,https://www.csis.org/blogs/trustee-china-hand/chinese-ev-dilemma-subsidized-yet-striking,4.0
2002 Toyota Land Cruiser Runs Apple CarPlay on Its Factory Touchscreen,science,https://www.thedrive.com/news/heres-how-a-2002-toyota-land-cruiser-can-run-apple-carplay-on-its-factory-touchscreen,4.0
Thoughts on desktop operating systems,science,https://tbolt.space/2024/6/20/desktop-operating-systems-2024,5.0
"Myst at 25: How it changed gaming, created addicts, and made enemies",science,https://www.fastcompany.com/90240345/myst-at-25-how-it-changed-gaming-created-addicts-and-made-enemies,6.0
Section 230 Sunset Act Would Cut Off Young People's Access to Online Communities,programming,https://www.teenvogue.com/story/section-230-sunset-act-young-people,4.0
Ask HN: Do you want a repo with examples of successful functional requirements?,science,item?id=40715959,4.0
Ladybird browser spreads its wings,security,https://lwn.net/Articles/976822/,5.0
Bessemer Venture Partners' Anti-Portfolio,software,https://www.bvp.com/anti-portfolio,5.0
Chasing a Bug in a SAT Solver,science,https://ochagavia.nl/blog/chasing-a-bug-in-a-sat-solver/,3.0
Algorithmic Fitting of Japanese Candy,politics,https://www.candyjapan.com/behind-the-scenes/algorithmic-fitting-of-japanese-candy,5.0
The Back of the Envelope (1984) [pdf],operating systems,https://www.seltzer.com/margo/teaching/CS508.19/background/p180-bentley.pdf,9.0
EVs Are Selling Well for Everyone Except Tesla,other,https://jalopnik.com/evs-are-selling-well-for-everyone-except-tesla-1851550953,5.0
"Europe's solar power surge hits prices, exposing storage needs",ai,https://www.euractiv.com/section/energy-environment/news/europes-solar-power-surge-hits-prices-exposing-storage-needs/,9.0
How to live with dying (2020),programming,https://theamericanscholar.org/how-to-live-with-dying/,6.0
Google Search is indexing has halted,science,https://twitter.com/rustybrick/status/1803925912720642536,5.0
"Artificial Intelligence: A Modern Approach, 4th ed",ai,http://aima.cs.berkeley.edu,6.0
ShotSpotter does not reduce gun violence or increase clearance rates,science,https://www.vitalcitynyc.org/articles/learning-about-shot-spotter-from-chicago,5.0
Gen Xers projected to see higher cancer rates than Boomers,science,https://www.npr.org/sections/shots-health-news/2024/06/20/nx-s1-5010707/cancer-rates-younger-gen-x-boomers,3.0
SpaceX unveils backpack-sized 'Starlink Mini' internet antenna for $599,privacy,https://www.cnbc.com/2024/06/20/spacex-unveils-starlink-mini-satellite-internet-antenna-for-599.html,3.0
Is Kotlin Multiplatform Replacing Flutter?,politics,item?id=40746826,9.0
Is 2024 the year of Windows on the desktop?,science,https://www.osnews.com/story/139987/is-2024-the-year-of-windows-on-the-desktop/,5.0
The exponential growth of solar power will change the world,other,https://www.economist.com/leaders/2024/06/20/the-exponential-growth-of-solar-power-will-change-the-world,6.0
A Rant about Front-end Development,science,https://blog.frankmtaylor.com/2024/06/20/a-rant-about-front-end-development/,5.0
AI tools are training on real childrens faces,operating systems,https://www.wired.com/story/ai-tools-are-secretly-training-on-real-childrens-faces/,5.0
The Engineer Who Refused to Approve the Challenger Launch,programming,https://www.npr.org/2021/03/07/974534021/remembering-allan-mcdonald-he-refused-to-approve-challenger-launch-exposed-cover,4.0
Show HN: A collection of front end Learning Resources,programming,https://github.com/requestly/awesome-frontend-resources,6.0
Athelas (YC S16) Is Hiring a Senior Full-Stack Software Engineer,software,https://www.athelas.com/careers?ashby_jid=55c6a105-80be-40b1-8644-cd44f48f1d08,5.0
The Pre-Scheme Restoration project is now underway,politics,https://prescheme.org/posts/announcing-the-pre-scheme-restoration.html,5.0
Electromechanical Lunar Lander,science,http://www.chrisfenton.com/electromechanical-lunar-lander/,6.0
Tetris Font (2020),science,https://erikdemaine.org/fonts/tetris/,5.0
Microsoft makes Copilot less useful on new Copilot Plus PCs,science,https://www.theverge.com/2024/6/21/24182979/microsoft-copilot-key-keyboard-shortcut-pwa,6.0
Starlink Mini brings space internet to backpackers,science,https://www.theverge.com/2024/6/21/24182970/starlink-mini-usb-power-specs-price,5.0
Show HN: I wrote a 2000 word article on dealing with chargebacks,science,https://operational.co/articles/complete-guide-on-chargebacks-for-saas-businesses,6.0
"FDA, Industry Actions End Sales of PFAS Used in Food Packaging",science,https://www.fda.gov/news-events/press-announcements/fda-industry-actions-end-sales-pfas-used-us-food-packaging,5.0
Pornhub prepares to block five more states rather than check IDs,science,https://arstechnica.com/tech-policy/2024/06/adult-sites-blocking-more-states-this-summer-to-protest-age-verification-laws/,6.0
Newest NATO Member Sweden Says Russia Disrupting Its Satellite Networks,science,https://www.bloomberg.com/news/articles/2024-06-20/newest-nato-member-sweden-says-russia-disrupting-its-satellite-networks,6.0
Going to War with the Army You Have,politics,https://acoup.blog/2024/06/21/collections-how-to-raise-a-tribal-army-in-pre-roman-europe-part-iii-going-to-war-with-the-army-you-have/,8.0
Fossil emissions hit record highs as world struggles with deadly heat,science,https://www.cnn.com/2024/06/20/climate/fossil-fuel-emissions-record-climate-intl/index.html,4.0
London hospitals hackers publish stolen blood test data,science,https://www.bbc.co.uk/news/articles/c9ww90j9dj8o,6.0
The Pre-Scheme Restoration,other,https://prescheme.org/posts/announcing-the-pre-scheme-restoration.html,5.0
"Climate engineering off US coast could increase heatwaves in Europe, study finds",politics,https://www.theguardian.com/environment/article/2024/jun/21/climate-engineering-off-us-coast-could-increase-heatwaves-in-europe-study-finds,4.0
AI is exhausting the power grid,other,https://www.washingtonpost.com/business/2024/06/21/artificial-intelligence-nuclear-fusion-climate/,5.0
Trump says foreigners who graduate from US colleges should get green cards,privacy,https://www.reuters.com/world/us/trump-says-foreign-college-graduates-should-automatically-get-green-cards-2024-06-20/,5.0
Testing Generative AI for Circuit Board Design,science,https://blog.jitx.com/jitx-corporate-blog/testing-generative-ai-for-circuit-board-design,5.0
How to prolong lithium based batteries,hardware,https://batteryuniversity.com/article/bu-808-how-to-prolong-lithium-based-batteries,6.0
From Infocom to 80 Days: An oral history of text games and interactive fiction,programming,https://arstechnica.com/gaming/2024/06/from-infocom-to-80-days-an-oral-history-of-text-games-and-interactive-fiction/,5.0
How does a computer/calculator compute logarithms?,politics,https://zachartrand.github.io/SoME-3-Living/,3.0
"CRIU, a project to implement checkpoint/restore functionality for Linux",ai,https://criu.org/Main_Page,5.0
Show HN: Lady Deirdre 2 – Rust Framework for Compilers and LSP Servers,programming,https://github.com/Eliah-Lakhin/lady-deirdre,5.0
54 Humans in One 8-meter Gravitics Module,programming,https://www.gravitics.com/news/54-humans-in-gravitics-modules,6.0
Patterns (YC S21) Is Hiring to Build Analytics Agents for Finance Teams,politics,https://patterns.app/,5.0
How the Square Root of 2 Became a Number,programming,https://www.quantamagazine.org/how-the-square-root-of-2-became-a-number-20240621/,5.0
Software design gets worse before it gets better,programming,https://tidyfirst.substack.com/p/the-trough-of-despair,5.0
"Allan McDonald refused to approve Challenger launch, exposed cover-up (2021)",ai,https://www.npr.org/2021/03/07/974534021/remembering-allan-mcdonald-he-refused-to-approve-challenger-launch-exposed-cover,6.0
MeshAnything – Converts 3D representations into efficient 3D meshes,ai,https://buaacyw.github.io/mesh-anything/,5.0
OpenAI Acquires Rockset,other,https://openai.com/index/openai-acquires-rockset/,6.0
Advanced Text Features and PDF,programming,https://nibblestew.blogspot.com/2024/06/advanced-text-features-and-pdf.html,6.0
Innovation heroes are a sign of a dysfunctional organization,ai,https://steveblank.substack.com/p/why-innovation-heroes-are-a-sign,4.0
Thai Cabinet Formally Approves Bid for BRICS Membership,science,https://thediplomat.com/2024/05/thai-cabinet-formally-approves-bid-for-brics-membership/,8.0
ChatGPT Fails to Understand Causation,programming,https://twitter.com/yudapearl/status/1804147019608658175,5.0
Reaching the Enchanted Forest,software,https://dansitu.substack.com/p/reaching-the-enchanted-forest,3.0
The Skyline Problem in Racket,science,https://jeapostrophe.github.io/2013-07-01-skyline-post.html,5.0
Kraken Says Hackers Turned to 'Extortion' After Exploiting Bug for $3M,software,https://www.coindesk.com/business/2024/06/19/kraken-says-hackers-turned-to-extortion-after-exploiting-bug-for-3m/,5.0
Twitter and the Spread of Academic Knowledge,hardware,https://mattsclancy.substack.com/p/twitter-and-the-spread-of-academic,6.0
Spending 3 months investigating a 7-year old bug and fixing it in 1 line of code,other,https://lemmy.world/post/16763534,5.0
"Humor, the software developer's secret weapon",programming,https://techxplore.com/news/2024-06-hidden-humor-software-secret-weapon.html,6.0
Bog gravel filtration: Water cleaned by Mother Nature (2015),science,https://www.pondtrademag.com/bog-gravel-filtration-water-cleaned-by-mother-nature/,6.0
Show HN: Eidos – Offline Alternative to Notion,science,https://github.com/mayneyao/eidos,6.0
The Opaque Industry Inflating Prices for Prescription Drugs,software,https://www.nytimes.com/2024/06/21/business/prescription-drug-costs-pbm.html,5.0
Dib Guide: Detecting Agile BS [pdf],science,https://media.defense.gov/2018/Oct/09/2002049591/-1/-1/0/DIB_DETECTING_AGILE_BS_2018.10.05.PDF,5.0
Ask HN: Do companies avoid hiring programmers who would rather do indie dev?,science,item?id=40749727,5.0
"Retro Pocket 386 Win 95 laptop sub $200, comes with 386SX40 processor, 8 MB RAM",programming,https://www.tomshardware.com/video-games/retro-gaming/retro-pocket-386-win-95-laptop-arrives-for-less-than-dollar200-comes-with-40mhz-386-sx-processor-8-mb-ram-and-replaceable-graphics,3.0
Ask HN: What skills do you think will be most in-demand in 10 years?,science,item?id=40748683,6.0
Show HN: wc-GPU: The Unix util `wc` running on a GPU,operating systems,https://github.com/fragmede/wc-gpu,5.0
Baba Is You: A puzzle game where the rules are objects you can manipulate,politics,https://www.hempuli.com/baba/,5.0
FDA Expands Approval of Gene Therapy for Patients with Muscular Dystrophy,programming,https://www.fda.gov/news-events/press-announcements/fda-expands-approval-gene-therapy-patients-duchenne-muscular-dystrophy,4.0
500k Books Have Been Deleted from the Internet Archive's Lending Library,science,https://www.techdirt.com/2024/06/20/500000-books-have-been-deleted-from-the-internet-archives-lending-library/,5.0
Elon Musk has another secret child with exec at his brain implant company,science,https://www.theverge.com/2024/6/21/24183083/elon-musk-secret-child-shivon-zilis-exec-neuralink,5.0
Ask HN: What indoor CO2 monitor do you recommend?,programming,item?id=40749275,5.0
Documenting Software Architectures,ai,https://newsletter.techworld-with-milan.com/p/documenting-software-architectures,8.0
The destruction of public health and the growing threat of an H5N1 pandemic,politics,https://www.wsws.org/en/articles/2024/06/20/kowh-j20.html,6.0
Mosquitoes released in Hawaii to save rare birds from extinction,privacy,https://www.theguardian.com/environment/article/2024/jun/21/mosquitoes-hawaii-rare-bird-honeycreeper-malaria-wolbachia-bacteria,6.0
Ask HN: Is anyone using alternative open email protocols like JMAP?,software,item?id=40748741,5.0
Always Already Programming,programming,https://gist.github.com/melaniehoff/95ca90df7ca47761dc3d3d58fead22d4,4.0
Apple won't roll out AI tech in EU market over regulatory concerns,science,https://www.bloomberg.com/news/articles/2024-06-21/apple-won-t-roll-out-ai-tech-in-eu-market-over-regulatory-concerns,7.0
Leachim – 4th grade teaching robot,science,https://en.wikipedia.org/wiki/Leachim_(Robot),5.0
Meta is tagging real photos as 'Made with AI',ai,https://techcrunch.com/2024/06/21/meta-tagging-real-photos-made-with-ai/,5.0
Multiple AI companies bypassing web standard to scrape publisher sites,ai,https://www.reuters.com/technology/artificial-intelligence/multiple-ai-companies-bypassing-web-standard-scrape-publisher-sites-licensing-2024-06-21/,5.0
Lake Karachay,politics,https://en.wikipedia.org/wiki/Lake_Karachay,4.0
When Your Game Is Bad but Your Optimisation Is Genius [video],science,https://www.youtube.com/watch?v=5zlfJW2VGLM,5.0
Is Tetris Really 40 This Year?,websites,https://www.timeextension.com/news/2024/06/anniversary-is-tetris-really-40-this-year,8.0
"Claudette, a new friend that makes Claude 3.5 Sonnet even nicer",science,https://www.answer.ai/posts/2024-06-21-claudette.html,5.0
"Brain health is rooted in state of mind, finds study",science,https://medicalxpress.com/news/2024-06-brain-health-rooted-state-mind.html,4.0
It seems routine to see a bunch of browser User-Agents from the same IP,security,https://utcc.utoronto.ca/~cks/space/blog/web/MultipleUserAgentsSameIP,5.0
Connection Machine Lisp (1986),science,https://dl.acm.org/doi/pdf/10.1145/319838.319870,5.0
Show HN: Store Text in Minesweeper,science,https://sdk.scroll.pub/treeComponentFramework/sweepercraft/#rows/8/columns/47/layout/aaaaacd4.aei8kijaFmYeIat4awKaaFeb8HiabaiabcqGcaFGceEah8aaaaaaaa,7.0
Change Healthcare confirms hackers stole medical records of Americans,politics,https://techcrunch.com/2024/06/21/change-healthcare-confirms-ransomware-hackers-stole-medical-records-on-a-substantial-proportion-of-americans/,9.0
The hobbyists who collect barf bags,programming,https://www.cnn.com/2024/06/19/travel/barf-bag-collectors-hobby-cec/index.html,7.0
Curating my corner of the Internet with a freehand web editor,other,https://rafichaudhury.com/site/blog/Freehand-Web,5.0
An essay on the history of mathematical typography (2017),science,http://www.practicallyefficient.com/2017/10/13/from-boiling-lead-and-black-art.html,5.0
You can now write React in Lua,other,https://github.com/jsdotlua/react-lua,6.0
Show HN: Primeval Numbers,other,https://aravind.rs/numbers,7.0
How to stop Perplexity and save the web from bad AI,science,https://www.platformer.news/how-to-stop-perplexity-oreilly-ai-publishing/,6.0
Underwater drones could shape a potential Taiwan-China conflict,ai,https://www.technologyreview.com/2024/06/20/1094051/how-underwater-drones-could-shape-a-potential-taiwan-china-conflict/,5.0
Does ChatGPT make us dumber?,science,https://bohdankit.com/does-chatgpt-make-us-dumber/,7.0
Postgres Indexing: When Does Brin Win?,software,https://www.crunchydata.com/blog/postgres-indexing-when-does-brin-win,4.0
"AI Develops ""Ground-Breaking"" New Magnet Free of Rare Earth Metals",science,https://www.iflscience.com/ai-develops-ground-breaking-new-magnet-free-of-rare-earth-metals-74751,6.0
Schema changes and the Postgres lock queue,ai,https://xata.io/blog/migrations-and-exclusive-locks,5.0
A New Kind Of Dance Science (combinatorics of social dancing),ai,https://zacksdancelab.com/blog/a-new-kind-of-dance-science/,5.0
Predicting Blood Glucose with Regression,hardware,https://maori.geek.nz/problems-with-predicting-blood-glucose-with-regression-571377170b8b,4.0
SSI vs. OpenAI,programming,https://ssi.inc/?vs_openai,5.0
The Hazardous Life of an Undersea Cable [video],other,https://www.youtube.com/watch?v=AFt9le2ytW0,4.0
Dear W3C and browsers – Please fix cookie consent,science,item?id=40741406,5.0
Wireless power transfer system achieves 270-kilowatt charge,science,https://www.ornl.gov/news/polyphase-wireless-power-transfer-system-achieves-270-kilowatt-charge-sets-another-world,7.0
A study has been following 'gifted' kids for 45 years. Here's what we've learned,science,https://www.upworthy.com/a-study-has-been-following-gifted-kids-for-45-years-heres-what-weve-learned-rp5,5.0
Records on 300M patient interactions with NHS stolen in Russian hack,hardware,https://www.theguardian.com/society/article/2024/jun/21/records-on-300m-patient-interactions-with-nhs-stolen-in-russian-hack,6.0
Study suggests at-camera gaze can increase scores in simulated interviews,programming,https://phys.org/news/2024-06-camera-scores-simulated.html,6.0
Factorio Fluids 2.0,politics,https://factorio.com/blog/post/fff-416,5.0
Tetris: Heavenly Scrolls (1989),ai,https://blog.gingerbeardman.com/2024/06/18/tetris-heavenly-scrolls/,5.0
An Introduction to Sleep Obfuscation for Malware (2023),operating systems,https://dtsec.us/2023-04-24-Sleep/,6.0
Studiesefrequent mowing puts poisonous weed into survival mode,operating systems,https://phys.org/news/2024-06-frequent-poisonous-weed-survival-mode.html,5.0
The new State of JavaScript 2023 survey results,programming,https://2023.stateofjs.com/en-US,4.0
South Korea will consider supplying arms to Ukraine,politics,https://apnews.com/article/north-korea-russia-kim-jong-un-putin-military-assistance-war-d9bb8aee7eb1a692b932337578fb3e30,4.0
Barcelona will eliminate ALL tourist apartments in 2028 following local backlash,science,https://www.theolivepress.es/spain-news/2024/06/21/breaking-barcelona-will-remove-all-tourist-apartments-in-2028-in-huge-win-for-anti-tourism-activists/,6.0
Migrating from Java 8 to Java 17: A Comprehensive Guide to New Features,science,https://igorstechnoclub.com/upgrading-to-java-17-a-comprehensive-guide-to-new-features/,6.0
A runaway plane took off by itself and spent 3 hours flying unpiloted in 1955,science,https://navyhistory.au/aster-shootdown-over-sydney-in-1955/,6.0
"We now have even more evidence against the ""ecocide"" theory of Easter Island",security,https://arstechnica.com/science/2024/06/we-now-have-even-more-evidence-against-the-ecocide-theory-of-easter-island/,5.0
Why SMBs Don't Deploy SSO,operating systems,https://www.cisa.gov/news-events/news/why-smbs-dont-deploy-single-sign-sso,4.0
Progress Quest,websites,http://www.progressquest.com/,5.0
TSMC experimenting with rectangular wafers vs. round for more chips per wafer,science,https://asia.nikkei.com/Business/Tech/Semiconductors/TSMC-explores-radical-new-chip-packaging-approach-to-feed-AI-boom,5.0
Show HN: High-Frequency Trading and Market-Making Backtesting Tool with Examples,science,https://github.com/nkaz001/hftbacktest/tree/master/rust,5.0
Self-driving Waymos secure final clearance for expansion beyond S.F,programming,https://www.sfchronicle.com/bayarea/article/self-driving-cars-waymo-sf-19523750.php,3.0
"Huawei unveils its own programming language the ""Cangjie""",websites,https://gsmchina.com/huawei-unveils-its-own-programming-language-the-cangjie-8687/,7.0
What good are whizzy new drugs if the world can't afford them?,science,https://www.economist.com/by-invitation/2024/06/14/what-good-are-whizzy-new-drugs-if-the-world-cant-afford-them,5.0
Apple Intelligence Features Not Coming to Europe at Launch Due to DMA,security,https://www.macrumors.com/2024/06/21/apple-intelligence-europe-delay/,5.0
Cudimm Standard Set to Make Desktop Memory a Bit Smarter and a Lot More Robust,software,https://www.anandtech.com/show/21455/making-desktop-ddr5-even-faster-cudimms-debut-at-computex,6.0
Ollama Release v0.1.45. Support DeepSeek-Coder-V2,politics,https://github.com/ollama/ollama/releases/tag/v0.1.45,7.0
Stat Inflation in Michael Jordan's 1988 DPOY Award Season,programming,https://sports.yahoo.com/a-closer-look-at-michael-jordans-1988-dpoy-award-raises-questions-about-its-validity-has-lebron-james-been-chasing-a-ghost-140452567.html,3.0
Perplexity Plagiarized Our Story About How Perplexity Is a Bullshit Machine,operating systems,https://www.wired.com/story/perplexity-plagiarized-our-story-about-how-perplexity-is-a-bullshit-machine/,5.0
