Title,Category,Link,Interest_Rating
A camera-less iPhone issued to my buddy that works at a Nuclear Plant,software,https://old.reddit.com/r/mildlyinteresting/comments/1dh72au/a_cameraless_iphone_issued_to_my_buddy_that_works/,4.0
EV startup Fisker files for bankruptcy,programming,https://www.reuters.com/business/autos-transportation/ev-startup-fisker-files-bankruptcy-2024-06-18/,7.0
Ask HN: How do you find a mentor in software engineering and in life?,politics,item?id=40714215,5.0
Ask HN: How to Survive when Life is in Pieces?,science,item?id=40714641,5.0
Apple Vision Pro as Screen Replacement Power User for 8hrs/day,ai,https://voicesofvr.com/1395-apple-vision-pro-as-screen-replacement-power-user-brad-lynch-on-overlays-multi-app-xr/,7.0
RLHF reduces LLM creativity and output variety,politics,https://twitter.com/rohanpaul_ai/status/1802523130704855375,3.0
OpenSSH 9.8,science,https://lists.mindrot.org/pipermail/openssh-unix-dev/2024-June/041381.html,6.0
"Duolingo, the App That Always Wins the Battle for Your Attention",politics,https://www.wsj.com/tech/personal-tech/duolingo-streaks-notifications-app-spanish-bc87d6e4,5.0
"At 15, Darlene Stubbs left a polygamous cult, found a new life through running",science,https://www.runnersworld.com/runners-stories/a60791305/short-creek-running-club-flds-polygamy/,6.0
"LiveView Is Not a Zero-JS Framework, It's a Zero-Boring-JS Framework",science,https://tylerbarker.com/posts/liveview-is-not-a-zero-js-framework-it-s-a-zero-boring-js-framework,4.0
"America Will Get Its $25,000 Electric Car?",other,https://www.bloomberg.com/news/articles/2024-06-17/when-will-america-get-its-25-000-electric-car,5.0
Brain circuit scores lead to clinically distinct biotypes in depression/anxiety,gaming,https://www.nature.com/articles/s41591-024-03057-9,6.0
"'Scared as hell': Climate scientists risk jobs, jail to save dying planet",science,https://www.aljazeera.com/features/2024/6/16/what-grief-for-a-dying-planet-looks-like-climate-scientists-on-the-edge-2,5.0
ChatGPT was down due to major outage – here's what happened,other,https://www.tomsguide.com/news/live/chatgpt-outage-june-2025,7.0
FreeBSD 14.1 vs. DragonFlyBSD 6.4 vs. NetBSD 10 vs. Linux Benchmarks,politics,https://www.phoronix.com/review/bsd-linux-threadripper-7980x,5.0
Anthony Fauci: The First Three Months of the Pandemic,ai,https://www.theatlantic.com/magazine/archive/2024/07/anthony-fauci-covid-trump-white-house-response/678491/,4.0
Is Seat Based Pricing Dead?,websites,https://cloudedjudgement.substack.com/p/clouded-judgement-61424-is-seat-based,5.0
How to Use Secure Sockets in C on Linux,science,https://netprivacypro.com/how-to-use-secure-sockets-in-c-on-linux/,5.0
PostmarketOS v24.06 Released,other,https://lwn.net/Articles/978733/,7.0
Keitora: Tiny Trucks – Japanology Plus (2022) [video],ai,https://www.youtube.com/watch?v=ZtPZ-EyAyWY,5.0
Ask HN: Is Dark Mode ever coming to HN?,ai,item?id=40706570,5.0
Fedora 41 Looks to Offer a KDE Plasma Mobile Spin,ai,https://www.phoronix.com/news/Fedora-41-KDE-Mobile-Proposal,6.0
What City Kids Learn on My Farm,politics,https://www.thefp.com/p/farm-camp-upstate-new-york-children-learn,3.0
"Sharing new research, models, and datasets from Meta FAIR",science,https://ai.meta.com/blog/meta-fair-research-new-releases/,4.0
3D Gaussian Splatting as Markov Chain Monte Carlo,science,https://ubc-vision.github.io/3dgs-mcmc/,2.0
"Show HN: Billard, Generate Music from Ball Collisions in 2D Space",programming,https://billard.medusis.com/,6.0
Visualizing Data on a Mesh with Displacement Mapping in R,ai,https://www.tylermw.com/posts/rayverse/displacement-mapping.html,4.0
Framework: A new RISC-V Mainboard from DeepComputing,science,https://frame.work/blog/introducing-a-new-risc-v-mainboard-from-deepcomputing,5.0
TikTag: bypassing ARM CPU MemTag via speculative execution attack,science,https://arxiv.org/abs/2406.08719,5.0
"Ubicloud (YC W24) Hiring Founding Engineer for ""Managed Kubernetes Service""",software,https://www.ycombinator.com/companies/ubicloud/jobs/zyE7d9T-founding-engineer-for-managed-kubernetes-service,8.0
"YaFSDP from Yandex, 20% faster for pre-training LLMs",programming,https://github.com/yandex/YaFSDP,5.0
A New Look: Solar Plant Prospection with Automated Viewshed Analysis,programming,https://www.go-inicio.com/blog/a-new-look-revolutionizing-solar-plant-prospection-with-automated-viewshed-analysis,4.0
BNSF ordered to pay $395M after years of trespassing on Swinomish land,privacy,https://www.kuow.org/stories/bnsf-ordered-to-pay-395-million-after-years-of-trespassing-on-swinomish-land,5.0
About the Solar Powered Website (2022),ai,https://solar.lowtechmagazine.com/about/the-solar-website/,6.0
Show HN: Quickly scan HN for new articles,politics,https://github.com/bachmitre/hacker-news-highlighter,4.0
Spur – RISC IV: The Lisp Multiprocessor Workstation,science,https://thechipletter.substack.com/p/spur-risc-iv-the-lisp-multiprocessor,6.0
What happens to latency if service time is cut in half (2022),programming,https://pveentjer.github.io/misc/2022/04/18/service-time-cut-in-half.html,5.0
A common misunderstanding about wave-particle duality,science,https://www.chemistryworld.com/opinion/a-common-misunderstanding-about-wave-particle-duality/4019585.article,5.0
The Public Interest Internet,ai,https://berjon.com/public-interest-internet/,4.0
FPGA-Based Disk Controller for the Apple II (2017),other,https://www.bigmessowires.com/2017/12/07/fpga-based-disk-controller-for-apple-ii/,6.0
Understanding the Misunderstood Kessler Syndrome,science,https://aerospaceamerica.aiaa.org/features/understanding-the-misunderstood-kessler-syndrome/,6.0
What Is ChatGPT Doing and Why Does It Work? (2023),science,https://writings.stephenwolfram.com/2023/02/what-is-chatgpt-doing-and-why-does-it-work/,5.0
Peak Population Projections,ai,https://dothemath.ucsd.edu/2024/06/peak-population-projections/,6.0
'Glowing' Plants Could Help Scientists Predict Flash Drought,programming,https://www.jpl.nasa.gov/news/ow-glowing-plants-could-help-scientists-predict-flash-drought,5.0
Oulipo's use of the Tohoku paper (2014),other,http://www.neverendingbooks.org/oulipos-use-of-the-tohoku-paper/,5.0
"Apple M4 Support Added to the LLVM Compiler, ARMv8.7",software,https://www.phoronix.com/news/Apple-M4-Added-To-LLVM-Clang,5.0
Grief is not a process with five stages. It is shattered glass,politics,https://psyche.co/ideas/grief-is-not-a-process-with-five-stages-it-is-shattered-glass,5.0
Ask HN: How do you structure your shared finances with your spouse/partner,science,item?id=40718498,5.0
Chat Control: Incompatible with Fundamental Rights (2022),science,https://freiheitsrechte.org/en/themen/digitale-grundrechte/chatkontrolle,6.0
Tiny beauty: how I make scientific art from behind the microscope,software,https://www.nature.com/immersive/d41586-024-02011-6/index.html,5.0
Ask HN: What are some iconic comments on HN?,ai,item?id=40719253,3.0
"Wind and solar power half the cost of coal and gas, 1/3 the cost of nuclear",politics,https://reneweconomy.com.au/wind-and-solar-power-half-the-cost-of-coal-and-gas-one-third-the-cost-of-nuclear-says-lazard/,5.0
Adding a JIT Compiler to CPython,ai,https://lwn.net/SubscriberLink/977855/5daef5af6b2d4c1b/,6.0
4k-year-old building discovered on hill earmarked for new Greek airport,ai,https://www.cnn.com/2024/06/14/science/crete-4000-year-old-building-intl-scli-scn/index.html,5.0
Jeff Hawkins Announces the Thousand Brains Project for AI,software,https://spectrum.ieee.org/jeff-hawkins,3.0
3D Printing a Bottle Assembly Line,science,https://hackaday.com/2024/06/16/3d-printing-a-bottle-labeling-assembly-line/,5.0
EU to Charge Apple for Violating DMA,science,https://mjtsai.com/blog/2024/06/17/eu-to-charge-apple-for-violating-dma/,6.0
ADP Research: The rise–and fall–of the software developer,other,https://www.adpri.org/the-rise-and-fall-of-the-software-developer/,5.0
Nanoclay: The liquid turning desert to farmland,science,https://www.bbc.com/future/bespoke/follow-the-food/the-spray-that-turns-deserts-into-farmland.html,4.0
China's next-gen sexbots powered by AI are about to hit the shelves,programming,https://www.scmp.com/news/china/science/article/3266964/chinas-next-gen-sexbots-powered-ai-are-about-hit-shelves,6.0
Intel releases OpenVINO 2024.2 with broader LLM and quantization support,politics,https://github.com/openvinotoolkit/openvino/releases/tag/2024.2.0,6.0
Programming with Lambda Calculus,science,https://hbr.github.io/Lambda-Calculus/lambda2/lambda.html,5.0
Making a Bignum Library for Fun,science,https://austinhenley.com/blog/bignum1.html,5.0
Tolkien memorial unveiled at author's college,science,https://www.bbc.com/news/articles/c255zgwze77o,3.0
Waymo Driver 3.5x better at avoiding injuries over 14.8M miles in SF and Phoenix,other,https://twitter.com/Waymo/status/1803095329304088922,5.0
VS Code extensions are less secure than browser extensions or even NPM packages,software,https://www.baldurbjarnason.com/2024/vscode-extensions-are-insecure/,3.0
Longer and Longer Freight Trains Drive Up the Odds of Derailment,science,https://www.scientificamerican.com/article/longer-freight-trains-are-more-likely-to-derail/,5.0
The Gods of Logic,programming,https://harpers.org/archive/2024/07/the-gods-of-logic-benjamin-labatut-ai/,5.0
A Hollywood star lobbies the EU for more surveillance (2022),science,https://netzpolitik.org/2022/dude-wheres-my-privacy-how-a-hollywood-star-lobbies-the-eu-for-more-surveillance/,7.0
The Surgeon General Calls for a Warning Label on Social Media,science,https://www.afterbabel.com/p/surgeon-general-warning,4.0
Social-Media Influencers Aren't Getting Rich–They're Barely Getting By,science,https://www.wsj.com/tech/social-media-influencers-arent-getting-richtheyre-barely-getting-by-71e0aad3,4.0
Framework: A new RISC-V Mainboard from DeepComputing,hardware,https://frame.work/fr/en/blog/introducing-a-new-risc-v-mainboard-from-deepcomputing,5.0
Emacs Is Like a Warm Blanket,science,https://chrismaiorana.com/emacs-is-like-a-warm-blanket/,6.0
"Recycling Solar Panels the Clean, Green Way",ai,https://spectrum.ieee.org/solar-panel-recycling-2668499710,4.0
New study finds potential alien mega-structures known as 'Dyson spheres',other,https://www.nbcnews.com/now/video/new-study-finds-potential-alien-mega-structures-known-as-dyson-spheres-213007941901,4.0
The Farmer Was Replaced (A Python-esque automated farming game),other,https://store.steampowered.com/app/2060160/The_Farmer_Was_Replaced/,5.0
Nvidia surpasses Microsoft market cap to become the largest company in the world,privacy,https://www.cnbc.com/2024/06/18/nvidia-passes-microsoft-in-market-cap-is-most-valuable-public-company.html,6.0
"""I've Got Nothing to Hide"" and Other Misunderstandings of Privacy (2008) [pdf]",other,https://www.cs.ru.nl/~jhh/pub/secsem/solove-nothing-to-hide.pdf,6.0
DeepComputing RISC-V Mainboard,ai,https://frame.work/products/deep-computing-risc-v-mainboard,6.0
EU's Chat Control puts security and privacy at risk,hardware,https://element.io/blog/eus-chat-control-puts-security-and-privacy-at-risk/,5.0
Leading chatbots are spreading Russian propaganda,hardware,https://www.axios.com/2024/06/18/ai-chatbots-russian-propaganda,5.0
"NASA Doubles Down, Advances 6 Innovative Tech Concepts to New Phase",ai,https://www.jpl.nasa.gov/news/nasa-doubles-down-advances-6-innovative-tech-concepts-to-new-phase,5.0
June and Jennifer Gibbons – The Twins WHO Only Spoke to Each Other,programming,https://unbelievable-facts.com/2017/02/june-and-jennifer-gibbons.html,5.0
Gavin Newsom wants to take smartphones out of schools,websites,https://www.politico.com/news/2024/06/18/gavin-newsom-wants-to-take-smart-phones-out-of-schools-00163852,5.0
Chat control: EU attempt to bulk search private messages and destroy encryption,ai,https://www.patrick-breyer.de/en/chat-control-new-eu-government-attempt-to-bulk-search-private-messages-and-destroy-secure-end-to-end-encryption/,7.0
Apple just made your app obsolete? You've been 'Sherlocked',programming,https://text.npr.org/g-s1-4912,7.0
Exotic black holes could be a byproduct of dark matter,science,https://news.mit.edu/2024/exotic-black-holes-could-be-dark-matter-byproduct-0606,3.0
Sales Whisperer: A Human-Inconspicuous Attack on LLM Brand Recommendations,programming,https://www.researchgate.net/publication/381294800_Sales_Whisperer_A_Human-Inconspicuous_Attack_on_LLM_Brand_Recommendations,6.0
Hackers Detail How They Allegedly Stole Ticketmaster Data from Snowflake,ai,https://www.wired.com/story/epam-snowflake-ticketmaster-breach-shinyhunters/,5.0
Ask HN: What do Engineering Managers do at your company?,politics,item?id=40713388,4.0
Apple Reportedly Suspends Work on Vision Pro 2,other,https://www.macrumors.com/2024/06/18/apple-suspends-work-on-vision-pro-2/,3.0
Encryption is deeply threatening to power: Meredith Whittaker of Signal app,other,https://www.theguardian.com/technology/article/2024/jun/18/encryption-is-deeply-threatening-to-power-meredith-whittaker-of-messaging-app-signal,4.0
AI can't fix what automation already broke,hardware,https://www.bloodinthemachine.com/p/ai-cant-fix-everything-automation,5.0
Show HN: A beat composer by placing beans on paper [video],science,https://www.youtube.com/watch?v=B9WNFpBFMP8,6.0
What Game Are You Playing?,science,https://www.autodidacts.io/what-game-are-you-playing/,7.0
Biden offers citizenship path to spouses of US citizens,politics,https://www.reuters.com./world/us/biden-offers-path-citizenship-spouses-us-citizens-election-year-gambit-2024-06-18/,4.0
"In Sweden, a far-right assault on the media is undermining the Nordic model",science,https://www.theguardian.com/commentisfree/article/2024/jun/17/sweden-far-right-media-nordic-model,5.0
Asus' first Snapdragon X Elite laptop (mostly) blows away the MacBook Air M3,science,https://www.tomsguide.com/computing/laptops/asus-vivobook-s-15-snapdragon-x-elite-review,5.0
Giant viral signatures on the Greenland ice sheet,ai,https://microbiomejournal.biomedcentral.com/articles/10.1186/s40168-024-01796-y,5.0
We quit our jobs with my gf last year to create this game (for real),politics,https://imgur.com/gallery/erHVjyZ,5.0
Government by Algorithm,ai,https://en.wikipedia.org/wiki/Government_by_algorithm,5.0
"Boeing hid questionable parts from regulators, possibly installed in 737 MAX",science,https://www.cnn.com/2024/06/18/business/boeing-whistleblower-calhoun-testimony/index.html,6.0
Nearly 20% of SQL Servers running have passed end of support,websites,https://www.theregister.com/2024/06/17/outdated_sql_server/,5.0
How to Get Rich and Why the Only Way Is to Have Rich Parents [video],science,https://www.youtube.com/watch?v=a-ohZ74hdeI,5.0
We Support Meritocracy,programming,https://www.meritocracy.com/,5.0
Ask HN: What is a good website/app for math practice?,hardware,item?id=40704367,7.0
KDE Plasma 6.1 Released,other,https://kde.org/announcements/plasma/6/6.1.0/,6.0
Social Media Messed Up Our Kids. Now It Is Making Us Ungovernable,science,https://www.noemamag.com/social-media-messed-up-our-kids-now-it-is-making-us-ungovernable/,5.0
"Neofetch developer archives all his repositories: ""Have taken up farming""",programming,https://github.com/dylanaraps,6.0
Monitoring marine litter from space is now a reality,science,https://www.esa.int/Enabling_Support/Space_Engineering_Technology/Monitoring_marine_litter_from_space_is_now_a_reality,9.0
"Slack Combines ASTs with LLMs to Automatically Convert 80% of 15,000 Unit Tests",hardware,https://www.infoq.com/news/2024/06/slack-automatic-test-conversion/,5.0
"Beyond velocity and acceleration: jerk, snap and higher derivatives (2016)",security,https://iopscience.iop.org/article/10.1088/0143-0807/37/6/065008,5.0
Astronomers see a black hole awaken in real time,operating systems,https://www.eso.org/public/germany/news/eso2409/,7.0
KidPix,science,https://kidpix.app,6.0
Rethinking Open Source Generative AI: Open-Washing and the EU AI Act,science,https://opening-up-chatgpt.github.io/,8.0
Ribbon Health (YC S17) Is Hiring a Sales Eng Director for Enterprises,ai,https://www.ribbonhealth.com/open-roles?gh_jid=5179134004,6.0
Fern Hollow Bridge should have been closed years before it collapsed,science,https://practical.engineering/blog/2024/6/18/this-bridge-should-have-been-closed-years-before-it-collapsed,4.0
There's more to mathematics than rigour and proofs,software,https://terrytao.wordpress.com/career-advice/theres-more-to-mathematics-than-rigour-and-proofs/,3.0
2.6M Piracy Reports Against French Users Resulted in 234 Financial Penalties,ai,https://torrentfreak.com/2-6m-piracy-reports-against-french-users-resulted-in-234-financial-penalties-2240618/,5.0
Show HN: ESP32S3 ZXSpectrum,privacy,item?id=40679184,6.0
"One year of solo dev, wrapping up the grant-funded work",programming,https://www.marginalia.nu/log/a_107_nlnext/,9.0
ExectOS – brand new operating system which derives from NT architecture,science,https://exectos.eu.org/,5.0
Open Source Python ETL,programming,https://amphi.ai/,5.0
Rare twin elephants born in Thailand,software,https://www.bbc.com/news/articles/c8445lyjndvo,6.0
Show HN: Billard – Generate music from ball collisions in 2D space,politics,https://billard.medusis.com/,6.0
Off-path TCP hijacking in NAT-enabled Wi-Fi networks,programming,https://blog.apnic.net/2024/06/18/off-path-tcp-hijacking-in-nat-enabled-wi-fi-networks/,5.0
"Show HN: Pomoglorbo, a TUI Pomodoro timer for your terminal",science,https://codeberg.org/justusw/Pomoglorbo,6.0
"Linux China, which supported the Chinese open source community, has ended",ai,https://linux.cn/article-16602-1.html,8.0
Large language model data pipelines and Common Crawl,programming,https://blog.christianperone.com/2023/06/appreciating-llms-data-pipelines/,8.0
The enduring mystery of how water freezes,science,https://www.quantamagazine.org/the-enduring-mystery-of-how-water-freezes-20240617/,6.0
IPC in Rust – A Ping Pong Comparison,other,https://3tilley.github.io/posts/simple-ipc-ping-pong/,7.0
Show HN: I made an open source and local translation app,other,https://github.com/niedev/RTranslator,6.0
Refusal in language models is mediated by a single direction,other,https://arxiv.org/abs/2406.11717,3.0
Serialization for C# Games,programming,https://chickensoft.games/blog/serialization-for-csharp-games/,9.0
Comma Gets a Cure,programming,https://www.dialectsarchive.com/comma-gets-a-cure,8.0
EU Council to Vote on Chat Scanning Proposal on Thursday,science,https://www.patrick-breyer.de/en/posts/chat-control/,6.0
Global PV installations may hit 660 GW in 2024,science,https://www.pv-magazine.com/2024/06/18/global-pv-installations-to-reach-up-to-660-gw-in-2024-says-bernreuter-research/,3.0
In Praise of 5-Over-1 Buildings (2019),politics,https://commonedge.org/in-praise-of-5-over-1-buildings/,5.0
Nature retracts paper that claimed adult stem cell could become any type of cell,science,https://retractionwatch.com/2024/06/18/nature-retracts-highly-cited-2002-paper-that-claimed-adult-stem-cells-could-become-any-type-of-cell/,5.0
Ask HN: Why do message queue-based architectures seem less popular now?,science,item?id=40723302,7.0
Sculpting the moon in R: Subdivision surfaces and displacement mapping,politics,https://www.tylermw.com/posts/rayverse/displacement-mapping.html,5.0
Agrippa (A Book of the Dead),science,https://www.filfre.net/2018/09/agrippa-a-book-of-the-dead/,6.0
A new RISC-V Mainboard from DeepComputing,ai,https://frame.work/blog/introducing-a-new-risc-v-mainboard-from-deepcomputing,7.0
Why Dolphin Isn't Coming to the App Store (Spoiler: It Needs a JIT),science,https://daringfireball.net/linked/2024/06/18/dolphin-jit-apple,4.0
Walking the Titanic in 4K (Demo in Unreal Engine) [video],science,https://www.youtube.com/watch?v=Y2tIFI9B5DE,6.0
Qt 6.7.2 Released,ai,https://www.qt.io/blog/qt-6.7.2-released,4.0
Royal Mail owners agree to £5B takeover offer,other,https://www.bbc.com/news/articles/c4nn0n93zj4o,2.0
'Glowing' plants could help scientists predict flash drought,programming,https://www.jpl.nasa.gov/news/ow-glowing-plants-could-help-scientists-predict-flash-drought,5.0
Revolutionizing solar plant prospection with automated viewshed analysis,science,https://www.go-inicio.com/blog/a-new-look-revolutionizing-solar-plant-prospection-with-automated-viewshed-analysis,8.0
"YaFSDP: a sharded data parallelism framework, faster for pre-training LLMs",ai,https://github.com/yandex/YaFSDP,6.0
Meta releases Threads API for developers to build 'unique integrations',operating systems,https://www.theverge.com/2024/6/18/24180794/meta-threads-api-developers-launch-availability,6.0
Boeing Sent Two Astronauts into Space. Now It Needs to Get Them Home,other,https://www.wsj.com/science/space-astronomy/boeing-sent-two-astronauts-into-space-now-it-needs-to-get-them-home-99d96633,8.0
TikTag: Breaking ARM's memory tagging extension with speculative execution,science,https://arxiv.org/abs/2406.08719,6.0
"Sequoia is both more and less generous to Intel Macs, depending on the model",other,https://arstechnica.com/gadgets/2024/06/the-case-for-and-against-macos-15-sequoia-being-the-final-release-for-intel-macs/,6.0
Versioning FreeCAD Files with Git (2021),politics,https://blog.lambda.cx/posts/freecad-and-git/,5.0
Cyber Scarecrow,ai,https://www.cyberscarecrow.com/,8.0
NLnet; 45 Projects Receiving New NGI Zero Grants,programming,https://nlnet.nl/news/2024/20240618-Call-announcement.html,5.0
Why Your SSD (Probably) Sucks and What Your Database Can Do About It,science,https://cedardb.com/blog/ssd_latency/,4.0
Another Company Caught Using AI to Create Fake Journalists and Journalism,science,https://www.techdirt.com/2024/06/12/yet-another-company-caught-using-ai-to-quietly-create-fake-journalists-and-fake-journalism/,5.0
Mimicking an Elephant Trunk,other,https://physics.aps.org/articles/v17/98,6.0
"Willie Mays, SF Giants baseball player, has died",politics,https://www.sfchronicle.com/sports/giants/article/willie-mays-dead-obituary-17815215.php,5.0
"Elon Musk's X revenue has officially plummeted, new documents show",ai,https://mashable.com/article/twitter-x-revenue-falls-x-payments-plans,8.0
I'm the hacker that brought down North Korea's Internet for over a week. AMA,hardware,https://old.reddit.com/r/IAmA/comments/1divlp3/im_the_hacker_that_brought_down_north_koreas/,8.0
Generating audio for video: using video and text prompts to generate soundtracks,programming,https://deepmind.google/discover/blog/generating-audio-for-video/,5.0
How Vannevar Bush Engineered the 20th Century,science,https://spectrum.ieee.org/vannevar-bush,8.0
Apple issues 'serious' under landmark EU rules: Vestager,science,https://www.cnbc.com/2024/06/18/apple-issues-very-serious-under-landmark-eu-rules-vestager.html,5.0
Ask HN: How do you find developers for open source bug bounties?,science,item?id=40682632,7.0
Boeing CEO admits company has retaliated against whistleblowers,ai,https://www.independent.co.uk/news/world/americas/boeing-ceo-senate-testimony-whistleblower-news-b2564778.html,7.0
Nvidia becomes most valuable company,programming,https://www.bbc.com/news/articles/cyrr40x0z2mo,6.0
The Big Problem Your Startup Needs to Solve,ai,https://www.indiehackers.com/post/the-big-problem-your-startup-needs-to-solve-56593e947a,5.0
Most stocks hyped as winners from AI boom have fallen this year,other,https://www.ft.com/content/1e02d0d3-3f0b-4bd1-a79c-9fd45d1b6056,4.0
9 Out of 10 People Are Willing to Earn Less Money to Do More-Meaningful Work,science,https://hbr.org/2018/11/9-out-of-10-people-are-willing-to-earn-less-money-to-do-more-meaningful-work,4.0
US Navy successfully connects aircraft carrier to the cloud,programming,https://www.datacenterdynamics.com/en/news/navy-successfully-connects-aircraft-carrier-to-the-cloud/,8.0
An AI bot is (sort of) running for mayor in Wyoming,ai,https://www.wired.com/story/ai-bot-running-for-mayor-wyoming/,4.0
One in four US households likely exceed new soil lead guidance levels,ai,https://agupubs.onlinelibrary.wiley.com/doi/10.1029/2024GH001045,4.0
Amazon fined $5.9M for breaking labor law in California,programming,https://www.washingtonpost.com/technology/2024/06/18/amazon-fine-labor-law-california/,6.0
A Sense of Rebellion — A Podcast Series by Evgeny Morozov,privacy,https://www.sense-of-rebellion.com/,6.0
I Spent a Week Eating Discarded Restaurant Food. But Was It Going to Waste?,politics,https://www.wired.com/story/too-good-to-go-app-week-food-waste/,4.0
Ask HN: How to Become a Billionare?,science,item?id=40724532,4.0
The misunderstood Kessler Syndrome,science,https://aerospaceamerica.aiaa.org/features/understanding-the-misunderstood-kessler-syndrome/,5.0
N-Acetyl Cysteine Prevents Arterial Thrombosis in Vitro and in Mice,science,https://www.ahajournals.org/doi/10.1161/ATVBAHA.123.319044,4.0
California moves to modify law letting workers sue employers,other,https://www.nytimes.com/2024/06/18/business/economy/california-newsom-labor.html,4.0
Only Glass Nuclear Reactor [video],other,https://www.youtube.com/watch?v=uIIcEDzYsA4,5.0
Instagram Is Not a Cigarette,science,https://www.theatlantic.com/technology/archive/2024/06/surgeon-general-social-media-warning/678721/,3.0
The Framework Laptop 13 is about to become one of the first RISC-V laptops,science,https://www.theverge.com/2024/6/18/24181278/framework-laptop-risc-v-laptop-isa-arm-amd-intel-x86,5.0
Surface UEFI: Now using Rust,politics,https://techcommunity.microsoft.com/t5/surface-it-pro-blog/surface-uefi-evolution-in-boot-security-amp-device-management-to/ba-p/4159998,5.0
Fast Crimes at Lambda School,science,https://www.sandofsky.com/lambda-school/,5.0
Ask HN: Treadmill under your desk – gimmick or worth it?,software,item?id=40721771,7.0
Call Centers Introduce 'Emotion Canceling' AI as a 'Mental Shield' for Workers,programming,https://gizmodo.com/call-center-ai-softbank-softvoice-first-horizon-1851546327,5.0
Ask HN: Who has had a successful PWA product?,security,item?id=40724774,6.0
