Title,Category,Link,Interest_Rating
AI Unearths Nearly a Million Potential Antibiotics to Take Out Superbugs,programming,https://singularityhub.com/2024/06/10/ai-unearths-nearly-a-million-potential-antibiotics-to-take-out-superbugs/,6.0
You can help Anna's Archive by seeding torrents,programming,https://annas-archive.org/torrents,5.0
Version 256 of systemd boasts '42% less Unix philosophy',science,https://www.theregister.com/2024/06/13/version_256_systemd/,6.0
Extensible scheduler class to be merged for 6.11,other,https://lwn.net/Articles/978007/,7.0
"Design goals, advantages and benefits of Flow Computing [pdf]",ai,https://s3.documentcloud.org/documents/24741449/flow-computing-white-paper-design-goals-and-hw-sw-advantages-2024-5.pdf,5.0
nsnotifyd-2.1 released,science,https://dotat.at/@/2024-06-12-nsnotifyd-2-1-released.html,5.0
Ask HN: Who'll take ownership of AI's mistakes?,security,item?id=40637927,9.0
Ask HN: How do you iterate on and manage prompts in production?,science,item?id=40647316,0.0
Spectrum of Covid-19: From Asymptomatic Organ Damage to Long Covid Syndrome,science,https://whn.global/scientific/spectrum-of-covid-19-from-asymptomatic-organ-damage-to-long-covid-syndrome/,5.0
Working with utilities to create a new model for clean energy,programming,https://blog.google/outreach-initiatives/sustainability/google-clean-energy-partnership/,5.0
What You Get After Running an SSH Honeypot for 30 Days,politics,https://blog.sofiane.cc/ssh_honeypot/,3.0
Show HN: We Made The World's Smallest and Cheapest Network Switch,science,https://docs.murexrobotics.com/elec/boards/networking/switch,5.0
Just Enough Software Architecture (2010),ai,https://www.georgefairbanks.com/book/,5.0
SimCity in the web browser using WebAssembly and OpenGL,science,https://micropolisweb.com/,6.0
The Architecture Behind a One-Person Tech Startup (2021),programming,https://anthonynsimon.com/blog/one-man-saas-architecture/,4.0
VVVV – A hybrid visual/textual development environment for .NET,science,https://visualprogramming.net/,6.0
"Ernest Shackleton's Last Ship, Quest, Discovered Off the Coast of Canada",science,https://www.smithsonianmag.com/smart-news/ernest-shackletons-last-ship-quest-discovered-off-the-coast-of-canada-180984545/,8.0
Reverse engineering a restaurant pager system,science,https://k3xec.com/td158/,5.0
Hokusai's 'Great Wave' features on new Japanese banknotes,science,https://www.cnn.com/style/article/japan-new-banknotes-great-wave/index.html,5.0
Is there an algorithm as beautiful as a poem?,science,https://tblm.substack.com/p/as-lovely-as-a-tree,3.0
"AI for math resources, and erdosproblems.com",privacy,https://terrytao.wordpress.com/2024/04/19/two-announcements-ai-for-math-resources-and-erdosproblems-com/,7.0
"Sequential Search, Correctly",politics,http://siek.blogspot.com/2024/06/sequential-search-correctly.html,5.0
Show HN: Keydogger – Minimal keyboard macro for Linux (Wayland),programming,https://github.com/jarusll/keydogger,8.0
Topological Problems in Voting,science,https://www.ryantolsma.com/thoughts/2024/06/14/topological-voting.html,1.0
How/Why to Sweep Async Tasks Under a Postgres Table [video],privacy,https://www.youtube.com/watch?v=wXXJuz_spcU&list=PLlrxD0HtieHg5ldHlEn3nMMpClX0RUntH&index=29,5.0
Survival of the Mediocre Mediocre (2018),ai,https://www.ribbonfarm.com/2018/04/24/survival-of-the-mediocre-mediocre/,4.0
Finding New Pastures: Big Nerd Ranch's Next Chapter,operating systems,https://bignerdranch.com/blog/finding-new-pastures-big-nerd-ranchs-next-chapter/,6.0
Engineer's solar panels are breaking efficiency records,politics,https://spectrum.ieee.org/solar-panels-breaking-efficiency-records,5.0
"Google, Cloudflare and Cisco will poison DNS to stop piracy block circumvention",politics,https://torrentfreak.com/google-cloudflare-cisco-will-poison-dns-to-stop-piracy-block-circumvention-240613/,4.0
Sans Bullshit Sans (2015),politics,https://www.sansbullshitsans.com/,7.0
The Sociological Study of Mental Illness: A Historical Perspective (2016),science,https://www.madinamerica.com/2016/07/the-sociological-study-of-mental-illness-a-historical-perspective/,4.0
Martin Amis and the pursuit of pleasure,other,https://www.newstatesman.com/culture/books/2024/06/martin-amis-and-the-pursuit-of-pleasure,8.0
Impulse Tracker source code now available on GitHub,hardware,https://github.com/jthlim/impulse-tracker,7.0
Why you shouldn't parse the output of ls(1),science,https://mywiki.wooledge.org/ParsingLs,6.0
Subducting plate structure and megathrust morphology at Cascadia,security,https://www.science.org/doi/10.1126/sciadv.adl3198,5.0
Doom for SNES full source code released by former Sculptured Software employee,other,https://gbatemp.net/threads/doom-for-snes-full-source-code-released-by-former-sculptured-software-employees.657118/,5.0
The LaTeX fetish (Or: Don't write in LaTeX It's just for typesetting) (2016),science,http://www.danielallington.net/2016/09/the-latex-fetish/,5.0
Fifty Years of Diff,programming,https://exple.tive.org/blarg/2024/06/14/fifty-years-of-diff-and-merge/,3.0
Fecal transplant pill replaces antibiotics for serious infections,science,https://english.elpais.com/health/2024-06-13/fecal-transplant-pill-replaces-antibiotics-for-serious-infections-for-the-first-time.html,5.0
Can language models serve as text-based world simulators?,programming,https://arxiv.org/abs/2406.06485,3.0
Astronomers discover Earth-sized exoplanet orbiting a nearby cool dwarf star,ai,https://phys.org/news/2024-06-astronomers-earth-sized-exoplanet-orbiting.html,8.0
"Ask HN: Do You Have a Copy of IBM ""Logo: Programming with Turtle Graphics""?",ai,item?id=40691792,6.0
Perplexity AI is lying about their user agent,science,https://rknight.me/blog/perplexity-ai-is-lying-about-its-user-agent/,6.0
The state of carbon dioxide removal,ai,https://www.stateofcdr.org,5.0
"A collection of 2,299 blogs about every topic",websites,https://ooh.directory/,5.0
"You've Read Your Last Free Article, Such Is the Nature of Mortality",science,https://www.mcsweeneys.net/articles/youve-read-your-last-free-article-such-is-the-nature-of-mortality,7.0
Common Lisp Community Survey 2024,science,https://cl-survey-2024.djhaskin.com/,8.0
Are animals conscious? How new research is changing minds,hardware,https://www.bbc.com/news/articles/cv223z15mpmo,9.0
Voyager 1 is back online: NASA spacecraft returns data from all 4 instruments,security,https://www.space.com/voyager-1-fully-operational,6.0
"Covid is coming for Calif., and it's already hitting the Bay Area the hardest",programming,https://www.sfgate.com/bayarea/article/covid-california-san-francisco-wastewater-19509336.php,7.0
Observable Framework 1.9,programming,https://github.com/observablehq/framework/releases/tag/v1.9.0,4.0
Show HN: Collate multiple PDFs into one with cover and automatic TOC,other,https://github.com/rossant/collatepdf,4.0
New Linux malware is controlled through emojis sent from Discord,websites,https://www.bleepingcomputer.com/news/security/new-linux-malware-is-controlled-through-emojis-sent-from-discord/,6.0
Bullshit.js,programming,https://mourner.github.io/bullshit.js/,4.0
The Weird Pod Metro That Lies Forgotten Under a Paris Suburb,ai,https://www.youtube.com/watch?v=bWxESIzJhCU,8.0
Reformatting 100k Files at Google in 2011,science,https://laurent.le-brun.eu/blog/the-story-of-reformatting-100k-files-at-google-in-2011,5.0
SQLite is likely used more than all other database engines combined,politics,https://sqlite.org/mostdeployed.html,5.0
SpiderBasic Code Viewer,programming,https://www.spiderbasic.com/showcase/onlineviewer/,5.0
Large birds can boost forest carbon storage – if deforestation doesn't interfere,hardware,https://news.mongabay.com/2024/06/large-birds-can-boost-forest-carbon-storage-if-deforestation-doesnt-interfere/,3.0
Docker Considered Harmful (2021),programming,https://catern.com/docker.html,7.0
Go is more than a language;Go is a platform,science,https://eltonminetto.dev/en/post/2024-06-12-go-is-a-plataform/,6.0
"OpenAI CEO says company could become for-profit corporation, Information reports",hardware,https://www.reuters.com/technology/artificial-intelligence/openai-ceo-says-company-could-become-benefit-corporation-information-2024-06-15/,6.0
Isograph – the UI framework for teams that move fast – without breaking things,science,https://isograph.dev/,4.0
Fungus breaks down ocean plastic,science,https://www.nioz.nl/en/news/fungus-breaks-down-ocean-plastic,5.0
CryptGPT: A Simple Approach to Privacy-Preserving LLMs Using Vigenere Cipher,other,https://huggingface.co/blog/diwank/cryptgpt-part1,5.0
"Joining Strings in Python: A ""Huh"" Moment",other,https://berglyd.net/blog/2024/06/joining-strings-in-python/,5.0
Rethinking the Transcript Editing Experience,software,https://blog.wordflo.ai/rethinking-transcript-editing-experience-22112,4.0
Ollama v0.1.45,security,https://github.com/ollama/ollama/releases/tag/v0.1.45-rc1,4.0
Global Warming and Ice Ages (1997) [pdf],software,https://mronline.org/wp-content/uploads/2020/07/29043613.pdf,3.0
London Underground hosts tests for 'quantum compass' that could replace GPS,science,https://www.theguardian.com/science/article/2024/jun/15/london-underground-quantum-compass-gps-subatomic-instrument-locations,6.0
PiWings 2.0 is a tiny drone based on Raspberry Pi Pico and ESP8266 WiFi module,science,https://www.cnx-software.com/2024/06/07/piwings-2-0-tiny-drone-based-on-raspberry-pi-pico-and-esp8266-wifi-module/,5.0
"Ask HN: Transitioning from web dev to more ""impactful"" tech",security,item?id=40692481,6.0
When to Write a Simulator,science,https://sirupsen.com/napkin/problem-16-simulation,6.0
Sharing wildlife sounds from all over the world,programming,https://xeno-canto.org/,5.0
A practical guide to starting out with Ollama LLM and Open WebUI,ai,https://www.theregister.com/2024/06/15/ai_rag_guide/,6.0
Uber and Lyft made a deal to raise drivers' wages: another victory for big tech,science,https://www.theguardian.com/technology/article/2024/jun/07/uber-lyft-wage-increase-big-tech-win,8.0
Why cheap US gas costs a fortune in Europe,science,https://www.politico.eu/article/cheap-us-gas-cost-fortune-europe-russia-ukraine-energy/,5.0
Show HN: 100% open-source voice assistant – as a HAL9000,science,https://github.com/juergenpabel/HAL9000,5.0
Building an O2 concentrator for welding and vacuum tube work,science,https://www.nickpoole.me/2024/06/01/building-an-oxikit-o2-concentrator-part-2/,6.0
Sweden says Russian warplane violated its airspace,privacy,https://www.euronews.com/2024/06/15/sweden-says-russian-warplane-violated-its-airspace,7.0
A brief history of Mac enclaves and exclaves,software,https://eclecticlight.co/2024/06/15/a-brief-history-of-mac-enclaves-and-exclaves/,5.0
Building Generative AI Apps with .NET 8 and Semantic Kernel,science,https://devblogs.microsoft.com/semantic-kernel/building-generative-ai-apps-with-net-8-and-semantic-kernel/,3.0
Apple Intelligence Won’t Work on Hundreds of Millions of iPhones,science,https://www.wired.com/story/apple-intelligence-wont-work-on-100s-of-millions-of-iphones-but-maybe-it-could/,6.0
Former CDC director predicts bird flu pandemic,science,https://thehill.com/policy/healthcare/4723753-former-cdc-director-predicts-bird-flu-pandemic/,7.0
Google is testing server-side ads that break adblockers,other,https://www.ghacks.net/2024/06/13/seeing-ads-on-youtube-google-is-testing-server-side-ads-that-break-adblockers/,5.0
"After Baillie Gifford, who is 'clean' enough to fund the arts?",science,https://www.ft.com/content/f17a7914-c6ac-4bcc-8aa6-3ad615ce8940,7.0
Syscallargs: A new tool for listing all Linux system calls with their arguments,software,https://tanelpoder.com/posts/list-linux-system-call-arguments-with-syscallargs/,6.0
"Scale AI: We hire for MEI: merit, excellence, and intelligence",science,https://twitter.com/alexandr_wang/status/1801331034916851995,6.0
Why I Like Programming in C. [video],science,https://www.youtube.com/watch?v=uWM0JvR972s,6.0
Enhancing Code Completion for Rust in Cody,science,https://sourcegraph.com/blog/enhancing-code-completion-for-rust-in-cody,5.0
Using drones to move cement bags up a mountain,ai,https://twitter.com/AshinChina/status/1801459781376610349,5.0
North Dakota voters just approved an age limit for congressional candidates,programming,https://apnews.com/article/north-dakota-congressional-candidates-age-limit-b9ffa598e76bf1dd440b3fb8efd4c33b,5.0
Amazon has a way to scrape GitHub and feed its AI model,other,https://dataconomy.com/2024/06/14/amazon-has-a-secret-way-to-scrape-microsofts-github-and-feed-its-ai-model/,9.0
"Edward Stone, 88, Physicist Who Oversaw Voyager Missions, Is Dead",privacy,https://www.nytimes.com/2024/06/14/science/space/edward-stone-physicist-dead.html,4.0
The world famous Roman Baths could help scientists counter antibiotic resistance,software,https://phys.org/news/2024-05-world-famous-roman-scientists-counter.html,6.0
The Impersonator: The Fake Data Were Coming from Inside the Lab,science,https://datacolada.org/117,3.0
Ask HN: Do you have a visual note taking app you enjoy?,politics,item?id=40661049,5.0
Ask HN: AI for converting Figma to Code,operating systems,item?id=40670296,4.0
Would astronauts' kidneys survive a roundtrip to Mars?,science,https://www.ucl.ac.uk/news/2024/jun/would-astronauts-kidneys-survive-roundtrip-mars,6.0
Kia Issues 'Park Outside' Recall for 2020-2024 Telluride Vehicles for Fire Risk,science,https://www.nhtsa.gov/press-releases/kia-telluride-recall-fire-risk,5.0
Ask HN: What non-mainstream programming languages are you checking out?,programming,item?id=40660760,6.0
AI discovers new rare-earth-free magnet at 200 times the speed of man,ai,https://newatlas.com/materials/ai-rare-earth-free-magnet-discovery/,6.0
Ending the 15% NYC broker's fee,science,https://www.nytimes.com/2024/06/12/nyregion/broker-fees-rent-nyc.html,3.0
Ask HN: Multicast over UDP vs. Multicast Mellanox Infiniband,science,item?id=40650957,5.0
"Show HN: I made first declaritive SVG,canvas framework",hardware,https://flitter.pages.dev,7.0
"Show HN: Paste2Download – No Login, No Ads, Download Videos Watermark Free",other,https://www.paste2download.com/,5.0
Pinterest Scaled to 11M Users with Only 6 Engineers,software,https://medium.com/codex/how-pinterest-scaled-to-11-million-users-with-only-6-engineers-a0f62cea62b8,6.0
"Show HN: Open Source Version of AI ""Math Notes"" from Apple WWDC",software,https://github.com/ayushpai/AI-Math-Notes,5.0
Experts vs. Imitators,ai,https://fs.blog/experts-vs-imitators/,6.0
"MicroMac, a Macintosh for Under £5",ai,https://axio.ms/projects/2024/06/16/MicroMac.html,5.0
Building SimCity: How to put the world in a machine,science,https://mitpress.mit.edu/9780262547482/building-simcity/,4.0
Quake 1 potential original font,programming,https://cohost.org/bekoha/post/2859948-quake-1-potential-or,5.0
Japanese Words and Names Sound African. Why?,science,https://www.farooqkperogi.com/2022/10/japanese-words-and-names-sound-african.html,8.0
How The Economist’s presidential forecast works,programming,https://www.economist.com/interactive/us-2024-election/prediction-model/president/how-this-works,5.0
Packaging Swift Apps for Alpine Linux,programming,https://mko.re/blog/swift-alpine-packaging/,6.0
Sales happen when buyers fear missing out,ai,https://tidyfirst.substack.com/p/sales-happen-when-buyers-fear-missing,4.0
Show HN: Searchable Kubernetes CSI provider listing,science,https://storageclass.info/storageclasses/,4.0
The Raspberry Pi 5 Is No Match for a Tini-Mini-Micro PC,politics,https://louwrentius.com/the-raspberry-pi-5-is-no-match-for-a-tini-mini-micro-pc.html,9.0
Simple sabotage for software (2023),other,https://erikbern.com/2023/12/13/simple-sabotage-for-software.html,4.0
Lago (Open Source Usage Based Billing) Is Hiring a Head of Finance (SF),science,https://jobs.lever.co/getlago/5f75502e-ecc5-4660-a2ad-e66f91e81e59,5.0
"Unveiling URI, URL, and URN",software,https://blog.logto.io/unveiling-uri-url-and-urn/,5.0
I've compared nearly all Rust crates.io crates to contents of their Git repos,programming,https://mastodon.social/@kornel/112626463128422583,5.0
OpenAI and Microsoft Azure to deprecate GPT-4 32K,science,https://twitter.com/headinthebox/status/1802404482174820398,6.0
PaperTapeReader: A DIY reader for vintage 8-bit paper tapes,other,https://github.com/dhansel/PaperTapeReader,7.0
How to enumerate trees from a context-free grammar,ai,https://arxiv.org/abs/2305.00522,6.0
Do you still count on your fingers?,programming,https://thonyc.wordpress.com/2024/06/13/do-you-still-count-on-your-fingers/,4.0
Why Structure and Interpretation of Computer Programs Matters,operating systems,https://people.eecs.berkeley.edu/~bh/sicp.html,6.0
The Theft of the Ghent Altarpiece,ai,https://www.historytoday.com/archive/missing-pieces/theft-ghent-altarpiece,5.0
The History of DR DOS,privacy,https://www.abortretry.fail/p/the-history-of-dr-dos,5.0
Htmd: A turndown.js inspired HTML-to-Markdown converter for Rust,ai,https://github.com/letmutex/htmd,8.0
Making my first embedded Linux system,ai,https://popovicu.com/posts/making-my-first-embedded-linux-system/,5.0
The 286's internal registers (2022),science,https://rep-lodsb.mataroa.blog/blog/the-286s-internal-registers/,4.0
The Banana Pi M7,ai,https://taoofmac.com/space/blog/2024/06/16/1800,7.0
Harvard Railroad Economics Exam (1906),other,https://www.irwincollier.com/harvard-enrollment-and-final-exam-for-railroad-practice-daggett-1906-1907/,5.0
"Edinburgh, Scotland makes it illegal to advertise SUVs",other,https://www.washingtonpost.com/climate-solutions/2024/06/15/fossil-fuel-advertising-bans-edinburgh/,5.0
Voyager Spacecraft and Fortran 5,science,http://www.geonius.com/writing/other/voyager.html,6.0
Logo: Programming with Turtle Graphics (IBM PC) (1983),operating systems,https://archive.org/details/logo-programming-with-turtle-graphics-ibm-pc,4.0
2 GHz Active Probe,other,https://jmw.name/projects/active-probe/,6.0
NumPy 2.0.0,hardware,https://pypi.org/project/numpy/,4.0
NLRB judge declares non-compete clause is an unfair labor practice,operating systems,https://www.nlrbedge.com/p/in-first-case-of-its-kind-nlrb-judge,6.0
Highly realistic talking head video generation,other,https://github.com/fudan-generative-vision/hallo,5.0
72% of U.S. high school teachers say cellphone distraction is a major problem,politics,https://www.pewresearch.org/short-reads/2024/06/12/72-percent-of-us-high-school-teachers-say-cellphone-distraction-is-a-major-problem-in-the-classroom/,7.0
As Lovely as a Tree,science,https://tblm.substack.com/p/as-lovely-as-a-tree,5.0
T-Glass: DIY Prism Display Glasses Powered by ESP32-S3 MCU,science,https://linuxgizmos.com/t-glass-diy-prism-display-glasses-powered-by-esp32-s3-mcu-and-onboard-6-axis-imu/,6.0
When to Write a Simulator (2021),ai,https://sirupsen.com/napkin/problem-16-simulation,5.0
Do not try to be the smartest in the room; try to be the kindest,science,https://www.jorgegalindo.me/en/blog/posts/do-not-be-the-smartest-in-the-room-try-to-be-the-kindest,8.0
Flesh-Eating Bacteria That Can Kill in Two Days Spreads in Japan,programming,https://www.bloomberg.com/news/articles/2024-06-15/flesh-eating-bacteria-that-can-kill-in-two-days-spreads-in-japan,7.0
TerraPower's Natrium: A Fast Neutron Reactor with Built-In Grid Level Storage,science,https://hackaday.com/2021/07/06/terrapowers-natrium-combining-a-fast-neutron-reactor-with-built-in-grid-level-storage/,5.0
Displaying a QR Code in MicroPython on the Tildagon Badge,ai,https://shkspr.mobi/blog/2024/06/displaying-a-qr-code-in-micropython-on-the-tildagon-badge/,6.0
Volvo's Battery Passport Traces the Supply Chain,programming,https://spectrum.ieee.org/volvo-ex90-battery-passport,6.0
"Ask HN: Freelancers, how do you get work?",security,item?id=40695679,5.0
Hokusai's 'Great Wave' features on new Japanese banknotes (2019),hardware,https://www.cnn.com/style/article/japan-new-banknotes-great-wave/index.html,6.0
Springer Nature unveils two new AI tools to protect research integrity,hardware,https://group.springernature.com/de/group/media/press-releases/new-research-integrity-tools-using-ai/27200740,3.0
"French court orders Google, Cloudflare, Cisco to poison DNS to stop piracy",security,https://torrentfreak.com/google-cloudflare-cisco-will-poison-dns-to-stop-piracy-block-circumvention-240613/,4.0
Stars show signs of hosting advanced alien civilisations,science,https://www.newscientist.com/article/2430601-dozens-of-stars-show-signs-of-hosting-advanced-alien-civilisations/,7.0
X.org Testing Ground Toolkit: Making It Less Difficult to Compile the X Server,hardware,https://www.phoronix.com/news/Xorg-Testing-Ground-Toolkit,6.0
Bengal famine: Susannah's grandad ran Bengal as famine killed millions,ai,https://www.bbc.co.uk/news/articles/c1vv9r4012xo,4.0
"TextGrad: Automatic ""Differentiation"" via Text",programming,https://arxiv.org/abs/2406.07496,6.0
Ancient Star Seen Zooming Through Space at 600 Kilometers per Second,operating systems,https://www.sciencealert.com/ancient-star-seen-zooming-through-space-at-600-kilometers-per-second,3.0
Solar Power's Giants Are Providing More Energy Than Big Oil,science,https://www.bloomberg.com/opinion/articles/2024-06-13/solar-power-s-giants-are-providing-more-energy-than-big-oil,5.0
Why I Like Programming in C [video],science,https://www.youtube.com/watch?v=uWM0JvR972s,5.0
YouTube is testing another way to combat ad blockers,websites,https://techcrunch.com/2024/06/16/youtube-is-testing-another-way-to-combat-ad-blockers/,8.0
Bill Gates Says He's Ready to Put Billions into Nuclear Power,politics,https://www.bloomberg.com/news/articles/2024-06-16/bill-gates-says-he-s-ready-to-put-billions-into-nuclear-power,5.0
From Fire Hazards to Family Trees: The Sanborn Fire Insurance Maps,other,https://publicdomainreview.org/essay/sanborn-fire-insurance-maps/,8.0
Remote workers using 'mouse-mover' technology are getting caught,security,https://www.theverge.com/2024/6/14/24178582/remote-work-mouse-jiggler-mover-wellsfargo,5.0
Simulations dampen excitement about liquid water on Mars,hardware,https://news.cornell.edu/stories/2024/06/simulations-dampen-excitement-about-liquid-water-mars,6.0
Xi Jinping claimed US wants China to attack Taiwan,science,https://www.ft.com/content/7d6ca06c-d098-4a48-818e-112b97a9497a,6.0
The Diesel Story – How EU Has Poisoned Its Citizens [video],websites,https://www.youtube.com/watch?v=w8r2xnITnqA,7.0
Post Office scandal victims in Scotland have convictions quashed,hardware,https://www.computerweekly.com/news/366588932/Post-Office-scandal-victims-in-Scotland-have-convictions-quashed,3.0
Insider view on how AMD lost the GPU oppty,politics,https://twitter.com/MohapatraHemant/status/1285234687267356672,6.0
Astronaut medical records reveal the health toll of space travel,science,https://www.newscientist.com/article/2435133-astronaut-medical-records-reveal-the-health-toll-of-space-travel/,4.0
The Only App That Always Wins the Battle for Your Attention,politics,https://www.wsj.com/tech/personal-tech/duolingo-streaks-notifications-app-spanish-bc87d6e4,4.0
What Makes Language Models Good-Enough?,software,https://arxiv.org/abs/2406.03666,5.0
My Encounter with the Fantasy-Industrial Complex,other,https://www.theatlantic.com/ideas/archive/2024/06/cia-renee-censorship-conspiracy-twitter/678688/,6.0
Tesla shareholders approved $56B package for Musk while Tesla laid of 10k people,hardware,https://twitter.com/DanPriceSeattle/status/1801707517069955202,6.0
European Alternatives,programming,https://european-alternatives.eu,6.0
"DNA: The data companies, countries and cops all want – 60 Minutes [video]",privacy,https://www.youtube.com/watch?v=-FKehavW1V8,3.0
Meta accused of trying to discredit ad researchers,science,https://www.theregister.com/2024/06/16/meta_ads_brazil/,7.0
"'Nemotron-4 340B' model redefines synthetic data generation, rivals GPT-4",science,https://venturebeat.com/ai/nvidias-nemotron-4-340b-model-redefines-synthetic-data-generation-rivals-gpt-4/,6.0
Heterogeneous integration of spin–photon interfaces with a CMOS platform,politics,https://www.nature.com/articles/s41586-024-07371-7,4.0
The Banishment of Beauty from Everyday Life,websites,https://www.honest-broker.com/p/the-banishment-of-beauty-from-everyday,4.0
Tesla Cybertruck deliveries halted amid problem with giant windshield wiper,programming,https://electrek.co/2024/06/15/tesla-cybertruck-deliveries-halted-amid-problem-giant-windshield-wiper/,6.0
25 years of fusion energy experiment data open on the 'cloud',science,https://phys.org/news/2024-06-years-massive-fusion-energy-cloud.html,6.0
Duke Energy power equipment in Durham damaged from gunfire after power outage,programming,https://apnews.com/article/duke-energy-north-carolina-durham-attack-outage-902b168403326384483e4464333471d0,4.0
Maxar's WorldView-3 satellite captured image of Starliner at ISS,software,https://www.space.com/boeing-starliner-iss-maxar-satellite-photo,5.0
"'In Nigeria, a tyre never quite dies': reinventing the wheel in Lagos",science,https://www.theguardian.com/global-development/article/2024/jun/06/in-nigeria-a-tyre-never-quite-dies-reinventing-the-wheel-in-lagos,3.0
NOAA Sea Level Rise and Coastal Flooding Impacts Viewer,science,https://coast.noaa.gov/slr/,6.0
Why the Heck Is There an EV Charger in the Middle of Nowhere in Wyoming?,other,https://cowboystatedaily.com/2024/06/15/why-the-heck-is-there-an-ev-charger-in-the-middle-of-nowhere-in-wyoming/,5.0
Submarine Cable Map,science,https://www.submarinecablemap.com,8.0
Ask HN: Where to find founders in their early 20s?,programming,item?id=40684011,5.0
Is there life on one of Saturn's moons? Scientists plan a mission to find out,science,https://www.theguardian.com/science/article/2024/jun/15/is-there-life-on-one-of-saturns-moons-scientists-plan-a-mission-to-find-out,6.0
Is there ever a good reason to disable swap?,other,item?id=40696959,3.0
